"TID","EN","AR","CN","CNT","DE","ES","FI","FR","FA","ID","IT","JP","KR","MS","NO","NL","PT","RU","TH","TR","VI"
"string","string","string","string","string","string","string","string","string","string","string","string","string","string","string","string","string","string","string","string","string","string"
"TID_EVENT_TRACK_REWARD_INFO_CHARACTER_NOT_AVAILABLE","Temporary Troops are no longer available","القوات المؤقتة لم تعد متوفرة.","无法再使用限时兵种","無法再使用限時兵種","Temporäre Einheiten sind nicht mehr verfügbar.","Las tropas temporales ya no están disponibles.","Väliaikaiset joukot eivät ole enää saatavilla.","Les troupes temporaires ne sont plus disponibles","نیروی موقت دیگر موجود نیستند","Peleton Sementara tidak tersedia untuk saat ini","Le truppe temporanee non sono più disponibili.","期間限定ユニットは利用できません","기간 한정 유닛을 더 이상 사용할 수 없습니다.","Askar sementara tidak lagi tersedia","Midlertidige tropper er ikke lenger tilgjengelig","Tijdelijke troepen zijn niet meer beschikbaar.","As tropas temporárias não estão mais disponíveis.","Временные войска больше не доступны","ไม่สามารถใช้กองกำลังชั่วคราวได้","Geçici birlikler artık yok.","Binh lính tạm thời không còn khả dụng nữa"
"TID_EVENT_CONFIRM_TIER_UNLOCK","Buy <num> Sour Elixir to reach the next reward tier?","أتريد شراء <num> من الإكسير الحمضي لبلوغ مستوى المكافآت التالي؟","购买<num>酸腐圣水立即解锁下一级奖励？","購買<num>酸腐聖水以立即解鎖下一階獎勵？","<num> Saures Elixier kaufen, um die nächste Belohnungsstufe zu erreichen?","¿Quieres comprar <num> de elixir ácido para alcanzar la siguiente marca de recompensas?","Ostatko <num> hapanta eliksiiriä päästäksesi seuraavalle palkintotasolle?","Acheter <num> unités d'élixir sinistre pour atteindre le palier suivant ?","می‌خواهید <num> اکسیر ترش را برای رسیدن به گام بعدی جایزه بخرید؟","Beli <num> Eliksir Edan untuk mencapai tingkat hadiah berikutnya?","Vuoi acquistare <num> unità di elisir acido per accedere alle ricompense della prossima soglia?","<num>禁断のエリクサーを購入して、次の報酬グレードに進みますか？","다음 보상 티어에 도달하기 위해 <num> 오싹한 엘릭서를 구매하시겠어요?","Beli <num> eliksir masam untuk ke peringkat ganjaran seterusnya?","Vil du kjøpe <num> sur eliksir for å nå det neste belønningsnivået?","Wil je <num> zuur elixir kopen om de volgende beloningsdrempel te bereiken?","Comprar <num> unidades de elixir ácido para alcançar o próximo nível de recompensa?","Купить <num> ед. кислого эликсира для перехода на следующий уровень наград?","ซื้อน้ำอมฤตหมัก <num> หยดเพื่อไปให้ถึงรางวัลขั้นต่อไปหรือไม่?","Bir sonraki ödül kademesine kalan <num> Ekşi İksiri almak istiyor musun?","Mua <num> Tiên dược chua để tiến đến bậc phần thưởng tiếp theo?"
"TID_EVENT_CONFIRM_TIER_UNLOCK_TITLE","Buy Sour Elixir?","أتريد شراء إكسير حمضي؟","购买酸腐圣水？","購買酸腐聖水？","Saures Elixier kaufen?","Comprar elixir ácido","Osta hapanta eliksiiriä?","Acheter de l'élixir sinistre ?","اکسیر ترش می‌خرید؟","Beli Eliksir Edan?","Acquisto di elisir acido","禁断のエリクサーを購入しますか？","오싹한 엘릭서를 구매할까요?","Beli eliksir masam?","Kjøpe sur eliksir?","Zuur elixir kopen?","Comprar elixir ácido?","Купить кислый эликсир?","ซื้อน้ำอมฤตหมักหรือไม่?","Ekşi İksir alınsın mı?","Mua Tiên dược chua?"
"TID_DECO_COZY_CLAM","Cozy Clam","محارة الاسترخاء","舒适贝壳","小憩貝殼","Kuschel-Muschel","Almeja acogedora","Suojaisa simpukka","Palourde moelleuse","صدف دنج","Kerang Relaksasi","Conchiglia del relax","くつろぎシェル","안락한 조개","Kerang Selesa","Koselig musling","Gezellige schelp","Concha aconchegante","Уютная раковина","เปลือกหอยแสนสบาย","Huzurlu Kabuk","Vỏ sò ấm cúng"
"TID_DECO_COZY_CLAM_INFO","Cozy Clam is the perfect relaxation spot to dream about hidden treasures while Clashing on your foldable device.","محارة الاسترخاء الباعث المثالي للشعور بالراحة، والحلم بالكنوز المخبأة في أثناء لعب Clash على جهازك القابل للطي.","想放松放松、做个挖到宝藏的美梦？快到“安逸贝壳”里面来！和折叠屏设备更配哦！","想要放鬆放鬆、做個挖到寶藏的美夢？快到「小憩貝殼」裡面吧！和摺疊手機很搭唷！","In der Kuschel-Muschel lässt es sich perfekt entspannen und von versteckten Schätzen träumen, während man auf einem faltbaren Gerät Clash spielt.","La almeja acogedora es el lugar perfecto para relajarse y soñar con tesoros escondidos mientras juegas a Clash en tu dispositivo plegable.","Suojaisa simpukka on täydellinen piilopaikka, jossa voit unelmoida kätketyistä aarteista. Rentoudu ja nauti Clashista!","La palourde moelleuse est l'endroit parfait pour se relaxer et rêver de trésors cachés tout en clashant sur votre tél.","صدف دنج جای فوق‌العاده‌ای برای تمدد اعصاب و رؤیاپردازی درباره گنجینه‌های پنهان در هنگام کلش بازی کردن در دستگاه تاشو شما است.","Dengan desain yang terinspirasi oleh ponsel lipat, Kerang Relaksasi adalah tempat sempurna untuk rehat sejenak sambil melamun tentang harta yang melimpah ruah.","La conchiglia del relax è il luogo perfetto per sognare tesori nascosti mentre giochi a Clash sul tuo dispositivo pieghevole.","くつろぎシェルは、折り畳み式デバイスでのバトル中にまだ見ぬ宝の山に想いを馳せながらリラックスするのに最適なリラクゼーションスポットです。","안락한 조개는 폴더블 기기에서 클래시를 플레이하는 동안 숨겨진 보물을 꿈꾸며 휴식을 취하기에 완벽한 장소입니다!","Kerang Selesa ialah tempat bersantai terbaik untuk bermimpi tentang khazanah tersembunyi sambil bertempur di peranti anda.","Koselig musling er det perfekte stedet for å slappe av og drømme om skjulte skatter mens du clasher på den sammenbrettbare enheten din.","De gezellige schelp is de perfecte plaats om te ontspannen en te dromen over verborgen schatten terwijl je Clash speelt.","A concha aconchegante é o lugar perfeito para sonhar com tesouros escondidos e jogar Clash no seu dispositivo.","Уютная раковина идеально подходит для того, чтобы отдохнуть и помечтать о сокровищах, играя в Clash!","เปลือกหอยแสนสบายเป็นจุดพักผ่อนหย่อนใจที่เหมาะสำหรับการฝันหวานถึงขุมสมบัติลับในขณะที่ท่านกำลังอัดอย่างเพลิดเพลินบนฝาหอยที่พับได้","Huzurlu Kabuk, katlanabilir cihazınızda Clash oynarken gizli hazinelerin hayalini kurabileceğiniz harika bir dinlenme yeri.","Vỏ sò ấm cúng là nơi hoàn hảo để nghỉ ngơi thư giãn và mơ về những kho báu ẩn giấu trong khi chơi Clash trên thiết bị có thể gập lại của mình."
"TID_DECO_HOG_PEN","Hog Pen","حظيرة خنازير","野猪圈","野豬圈","Schweinepferch","Pocilga","Karjujen karsina","Enclos de cochons","قلم خوک","Kandang babi","Porcile","ホグの囲い","호그 우리","Petak Khinzir","Grisebinge","Varkensstal","Chiqueiro","Кабаний загон","คอกหมูป่า","Domuz Ağılı","Chuồng heo"
"TID_DECO_DUCK_POND","Duck Bath","حوض استحمام بطة","小鸭浴盆","小鴨澡盆","Entenbad","Patito de goma","Ankkakylpy","Bain du canard","حمام اردک","Kolam bebek","Bagnetto","アヒル風呂","오리 둥둥 욕조","Tab Itik","Andebad","Badeend","Tina do patinho","Кадка с уточкой","อ่างอาบน้ำเป็ด","Banyo Ördeği","Chậu tắm cho vịt"
