"TID","EN","AR","CN","CNT","DE","ES","FA","FI","FR","ID","IT","JP","KR","MS","NL","NO","PT","RU","TH","TR","VI"
"TID_SPECIAL_OFFER_INFO_EASTER_LIMITED_999","• <res0> Gold\n• <res1> Dark Elixir\n• <gems> Gems\n\n• No storage limits!\n• This offer can be purchased 20 times!\n\nAwesome value for upgrading your Defenses, Heroes and Dark Elixir Troops in one neat bundle!","• <res0> ذهب\n• <res1> إكسير الظلام\n• <gems> جواهر\n\n• لا توجد حدود للتخزين!\n• يمكن شراء هذا العرض 20 مرة!\n\nتمتع بقيمة عظيمة في ترقية دفاعاتك، وأبطالك، وقوات إكسير الظلام في حزمة واحدة ممتازة!","• <res0>金币\n• <res1>暗黑重油\n• <gems>宝石\n\n• 存放礼包中的物品不受最大储量限制！\n• 该礼包可购买20次！\n\n升级防御建筑、英雄和暗黑重油部队，一个礼包全搞定，真是物超所值！","• <res0>金幣\n• <res1>闇黑重油\n• <gems>寶石\n\n• 存放特惠包中的物品不受最大儲存量限制！\n• 該特惠包可購買20次！\n\n升級防禦建築、英雄和闇黑重油部隊，一個特惠包全搞定，真是物超所值！","• <res0> Gold\n• <res1> Dunkles Elixier\n• <gems> Juwelen\n\n• Kein Lagerlimit!\n• Du kannst dieses Angebot 20-mal kaufen!\n\nEin prima Paket zur Verbesserung deiner Verteidigungen, Helden und Dunklen Truppen!","• <res0> de oro\n• <res1> de elixir oscuro\n• <gems> gemas\n\n• Sin límites de almacenamiento\n• ¡Esta oferta se puede comprar 20 veces!\n\n¡Una superoferta para mejorar tus defensas, héroes y tropas de elixir oscuro en un lote completísimo!","• <res0> طلا\n• <res1> اکسیر سیاه\n• <gems> جواهرات\n\n• بدون محدودیت ذخیره‌سازی!\n• این پیشنهاد را 20 بار می‌توان خریداری کرد!\n\nارتقاء ساختمان‌های دفاعی، قهرمانان و نیروهای اکسیر سیاه یکجا با قیمتی مقرون بصرفه!","• <res0> kultaa\n• <res1> mustaa eliksiiriä\n• <gems> jalokiveä\n\n• Ei varastointirajoja!\n• Tämän tarjouksen voi ostaa 20 kertaa!\n\nHanki rahoillesi vastinetta: päivitä puolustuksesi, sankarisi ja mustan eliksiirin joukkosi kertaheitolla!","• <res0> pièces d'or \n• <res1> unités d'élixir noir\n• <gems> gemmes\n\n• Pas de limite de stockage !\n• Vous pouvez acheter cette offre 20 fois !\n\nC'est le moment d'améliorer vos défenses, vos héros et vos troupes d'élixir noir avec ce pack pratique !","• <res0> Emas\n• <res1> Eliksir Hitam\n• <gems> Permata\n\n• Tanpa batas penyimpanan!\n• Penawaran ini dapat dibeli 20 kali!\n\nHarga yang menarik untuk meningkatkan Pertahanan, Pahlawan, dan Peleton Eliksir Hitam dalam satu paket menarik!","• <res0> oro\n• <res1> elisir nero\n• <gems> gemme\n\n• Nessun limite dei depositi!\n• Offerta acquistabile 20 volte!\n\nUn pacchetto davvero conveniente per migliorare le difese, gli eroi e le truppe nere!","• <res0>ゴールド\n• <res1>ダークエリクサー\n• <gems>エメラルド\n\n• 収容量制限なし！\n• このパックは20回購入できます！\n\n防衛設備やヒーロー、ダークエリクサーユニットをアップグレードするのにピッタリな役立つパック！","• <res0> 골드\n• <res1> 다크 엘릭서\n• 보석 <gems>개\n\n• 보관량 제한 없음!\n• 해당 특가 상품은 20번 구매할 수 있습니다!\n\n하나의 상품으로 방어시설, 영웅, 다크 엘릭서 유닛을 업그레이드할 수 있는 절호의 기회!","• <res0> Emas\n• <res1> Eliksir Kejahatan\n• <gems> Permata\n\n• Tiada had penyimpanan!\n• Tawaran ini boleh dibeli 20 kali!\n\nNilai hebat untuk menaik taraf Pertahanan, Wira dan Askar Elksir Kejahatan anda dalam satu berkas menarik!","• <res0> goud\n• <res1> duister elixir\n• <gems> edelstenen\n\n• Geen opslaglimieten.\n• Je kunt deze aanbieding 20 keer kopen.\n\nOngelooflijke voordelen om je verdedigingswerken, helden en duister-elixireenheden te upgraden in één weergaloos pakket.","• <res0> gull\n• <res1> mørk eliksir\n• <gems> juveler\n\n• Ingen lagringsbegrensninger!\n• Dette tilbudet kan kjøpes 20 ganger!\n\nMye for pengene hvis du vil oppgradere forsvarsverker, helter og mørk eliksir-tropper med en og samme pakke!","• <res0> de ouro\n• <res1> elixir negro\n• <gems> gemas\n\n• Sem limite de armazenamento!\n• Esta oferta pode ser comprada 20 vezes!\n\nExcelente para melhorar as defesas, os heróis e as tropas de elixir negro de uma vez só.","• Золото (<res0>).\n• Черный эликсир (<res1>).\n• Кристаллы (<gems>).\n\n• Не требует места в хранилище!\n• Этот набор можно приобрести 20 раз!\n\nПрекрасная возможность сэкономить на улучшении защиты, героев и воинов черного эликсира!","• ทองคำ <res0> เหรียญ\n• น้ำอมฤตมืด <res1> หยด\n• อัญมณี <gems> เม็ด\n\n• คลังไม่จำกัด!\n• ซื้อได้ 20 ครั้ง!\n\nคุ้มค่ามหาศาลต่อการอัปเกรดการป้องกัน ผู้กล้า และกองกำลังน้ำอมฤตมืดของท่านในห่อแจ๋วๆ ห่อเดียว!","• <res0> Altın \n• <res1> Kara İksir\n• <gems> Taş\n\n• Depolama sınırı yok!\n• Bu teklif sadece 20 kez satın alınabilir!\n\nSavunmalarını, kahramanlarını ve kara iksir birliklerini yükseltmek için muhteşem bir fırsat!","• <res0> Vàng\n• <res1> Hắc Tiên dược\n• <gems> Ngọc\n\n• Không giới hạn lưu trữ!\n• Bạn có thể mua ưu đãi này 20 lần!\n\nGiá trị tuyệt vời để nâng cấp Công trình phòng thủ, Tướng và Binh lính Hắc Tiên dược chỉ trong một gói ưu đãi cực chất này!"
"TID_SPECIAL_OFFER_EASTER_UNLIMITED","Builder Boost","تعزيز البنّاء","加速建筑工人","加速建築工人","Bauarbeiterpaket","Lote de construcción","تقویت سازنده","Rakentajan tehostus","Accélération des ouvriers","Pelaju Tukang","Potenziamento costruttore","大工ブーストパック","장인 부스트","Galakan Pembina","Bouwvakkersboost","Byggeboost","Pacote do Construtor","Ускорение строителя","บูสต์ช่างก่อสร้าง","İnşaatçı Desteği","Cường hóa Thợ xây"
"TID_SPECIAL_OFFER_INFO_EASTER_UNLIMITED","• <res0> Gold\n• <booster1>x Book of Building\n• <booster2>x Builder Potion\n• No storage limits!\n• This offer can be purchased 10 times!\n\nEverything you need for upgrading your Town Hall and Defenses!","• <res0> ذهب\n• <booster1>x كتاب المباني\n• <booster2>x جرعة البنّاء\n• لا توجد حدود للتخزين!\n• يمكن شراء هذا العرض 10 مرات!\n\nكل ما تحتاجه لترقية قاعة المدينة والدفاعات!","• <res0>金币\n• <booster1>本建筑之书\n• <booster2>瓶建筑工人药水\n• 存放礼包中的物品不受最大储量限制！\n• 该礼包可购买10次！\n\n包含升级大本营和防御建筑所需的一切！","• <res0>金幣\n• <booster1>本建築之書\n• <booster2>瓶建築工人藥水\n• 存放特惠包中的物品不受最大儲存量限制！\n• 該特惠包可購買10次！\n\n包含升級大本營和防禦建築所需的一切！","• <res0> Gold\n• <booster1>x Buch des Bauens\n• <booster2>x Bauarbeitertrank\n• Kein Lagerlimit!\n• Du kannst dieses Angebot 10-mal kaufen!\n\nAlles, was du zur Verbesserung deines Rathauses und deiner Verteidigungen brauchst!","• <res0> de oro\n• <booster1>x libro de construcción\n• <booster2>x pócima del constructor\n• Sin límites de almacenaje\n• ¡Esta oferta se puede comprar 10 veces!\n\n¡Todo lo que necesitas para mejorar tu ayuntamiento y tus defensas!","• <res0> طلا\n• <booster1> کتاب ساختمان\n• <booster2> معجون سازنده\n• بدون محدودیت ذخیره‌سازی!\n• این پیشنهاد را 10 بار می‌توان خریداری کرد!\n\nهمه آنچه برای ارتقاء تالار شهر یا ساختمان‌های دفاعی نیاز دارید!","• <res0> kultaa \n• <booster1> rakentamisen kirjaa\n•<booster2> rakentajan rohtoa\n• Ei varastointirajoja!\n• Tämän tarjouksen voi ostaa 10 kertaa!\n\nKaikki mitä tarvitset päärakennuksesi ja puolustuksesi päivittämistä varten!","• <res0> pièces d'or\n• <booster1>x livre des bâtiments\n• <booster2>x potion de l'ouvrier\n• Pas de limite de stockage !\n• Vous pouvez acheter cette offre 10 fois !\n\nTout ce qu'il vous faut pour améliorer votre hôtel de ville et vos défenses !","• <res0> Emas\n• <booster1>x Kitab Konstruksi\n•<booster2>x Ramuan Tukang\n• Tanpa batas penyimpanan!\n• Penawaran ini dapat dibeli 10 kali!\n\nSemua yang diperlukan untuk meningkatkan Balai Kota dan Pertahanan!","• <res0> oro\n• Libri degli edifici: <booster1>\n• Pozioni del costruttore: <booster2>\n• Nessun limite dei depositi!\n• Offerta acquistabile 10 volte!\n\nTutto ciò che ti serve per migliorare il municipio e le difese!","• <res0>ゴールド\n• 建物の本<booster1>冊\n• 大工ポーション<booster2>個\n• 収容量制限なし！\n• このパックは10回購入できます！\n\nタウンホールや防衛設備のアップグレードに必要なものが全部揃っています！","• <res0> 골드\n• 건물의 책 <booster1>개\n• 장인 포션 <booster2>개\n• 보관량 제한 없음!\n• 해당 특가 상품은 10번 구매할 수 있습니다!\n\n마을회관과 방어시설 업그레이드에 필요한 모든 것!","• <res0> Emas\n• <booster1>x Buku Bangunan\n• <booster2>x Posyen Pembina\n• Tiada had penyimpanan!\n• Tawaran ini boleh dibeli 10 kali!\n\nSegala yang anda perlukan untuk menaik taraf Dewan Bandaran dan Pertahanan anda!","• <res0> goud\n• <booster1>x het gebouwenboek\n• <booster2>x een bouwvakkersdrankje\n• Geen opslaglimieten.\n• Je kunt deze aanbieding tien keer kopen.\n\nAlles wat je nodig hebt om je stadhuis en verdedigingswerken te upgraden.","• <res0> gull\n• <booster1>x byggebok\n• <booster2>x byggerens drikk\n• Ingen lagringsbegrensninger!\n• Dette tilbudet kan kjøpes 10 ganger!\n\nAlt du trenger for å oppgradere rådhuset og forsvaret ditt!","• <res0> de ouro \n• <booster1>x Livro das Construções\n•<booster2>x Poção do Construtor\n• Sem limite de armazenamento!\n• Esta oferta pode ser comprada 10 vezes!\n\nTudo o que você precisa para melhorar o Centro da Vila e as defesas!","• Золото (<res0>).\n• Книга строительства (<booster1>).\n• Эликсир строителя (<booster2>).\n• Не требует места в хранилище!\n• Этот набор можно приобрести 10 раз!\n\nВсе, что нужно для улучшения ратуши и защиты!","• ทองคำ <res0> เหรียญ\n• ตำราสิ่งก่อสร้าง <booster1> เล่ม\n• น้ำยาช่างก่อสร้าง <booster2> ขวด\n• คลังไม่จำกัด!\n•ซื้อได้ 10 ครั้ง!\n\nทุกสิ่งที่ต้องใช้ในการอัปเกรดการป้องกันและศาลากลางของคุณ! อย่าพลาดข้อเสนอนี้เชียว!","• <res0> Altın\n• <booster1> İnşaat Kitabı\n• <booster2> İnşaatçı İksiri\n• Depolama sınırı yok!\n• Bu teklif sadece 10 kez satın alınabilir!\n\nBelediye Binanı ve savunmalarını yükseltmek için gereken her şey!","• <res0> Vàng \n• <booster1>x Công trình Thư\n•<booster2>x Thuốc Thợ xây\n• Không giới hạn lưu trữ!\n• Bạn có thể mua ưu đãi này 10 lần!\n\nCó tất cả mọi thứ mà bạn cần để nâng cấp Nhà Chính và Công trình phòng thủ!"
"TID_ACCOUNT_DELETED_ON_REQUEST_TEXT","This account has been disabled due to a deletion request and can no longer be recovered.","تم تعطيل هذا الحساب بموجب طلب حذف، ولا يمكن استرجاعه.","由于账号主人申请删除账号，本账号已被永久关闭，且无法再恢复。","由於帳號所有者申請刪除帳號，故該帳號已被永久刪除，並且無法恢復。","Dieses Konto wurde aufgrund einer Löschungsanfrage deaktiviert und kann nicht mehr wiederhergestellt werden.","Esta cuenta ha sido inhabilitada por una petición de eliminación y ya no se puede recuperar.","این حساب به خاطر یک درخواست حذف، غیرفعال شده است و دیگر نمی‌توان آن را بازیابی کرد.","Tämä tili on poistettu käytöstä poistopyynnön vuoksi, eikä sitä voida enää palauttaa.","Ce compte a été désactivé en raison d'une demande de suppression et ne peut plus être récupéré.","Akun ini telah dinonaktifkan karena adanya permintaan penghapusan. Akun tidak dapat dipulihkan lagi.","Questo account è stato disattivato in seguito a una richiesta e non può più essere recuperato.","このアカウントは削除依頼にもとづいて無効化されました。今後、復旧することはできません。","해당 계정은 삭제 요청으로 인해 비활성화되었으며, 더는 복구할 수 없습니다.","Akaun ini telah dinyahdayakan kerana ada permintaan pemadaman dan tidak boleh dipulihkan lagi.","Dit account is verwijderd overeenkomstig een verwijderingsverzoek en kan niet meer worden hersteld.","Denne kontoen er blitt deaktivert på grunn av en anmodning om sletting. Den kan ikke gjenopprettes.","Esta conta foi desativada devido a uma solicitação de exclusão e não pode mais ser recuperada.","Эта учетная запись отключена после запроса на удаление и не может быть восстановлена.","บัญชีนี้ถูกปิดการใช้งานเนื่องจากคำขอให้ทำการลบและไม่สามารถกู้คืนได้อีกต่อไป","Bu hesap, silme isteği nedeniyle devre dışı bırakıldı ve kurtarılamaz.","Tài khoản này đã bị vô hiệu hóa do yêu cầu xóa và không thể phục hồi được nữa."
"TID_ACCOUNT_DELETED_DUE_INACTIVITY_TEXT","This account has been disabled due to inactivity and can no longer be recovered.","تم تعطيل هذا الحساب نظرًا لعدم النشاط، ولا يمكن استرجاعه.","由于长期没有登录，该账号已被永久关闭，且无法再恢复。","由於長期未登入，故該帳號已被永久刪除，並且無法恢復。","Dieses Konto wurde aufgrund von Inaktivität deaktiviert und kann nicht mehr wiederhergestellt werden.","Esta cuenta ha sido inhabilitada por inactividad y ya no se puede recuperar.","این حساب به دلیل عدم فعالیت، غیر فعال شده است و دیگر نمی‌توان آن را بازیابی کرد.","Tämä tili on poistettu käytöstä inaktiivisuuden vuoksi, eikä sitä voida enää palauttaa.","Ce compte a été désactivé en raison de son inactivité et ne peut plus être récupéré.","Akun ini telah dinonaktifkan karena tidak adanya aktivitas. Akun tidak dapat dipulihkan lagi.","Questo account è stato disattivato per inattività e non può più essere recuperato.","このアカウントは長期間アクセスが確認できなかったため、無効化されました。今後、復旧することはできません。","해당 계정은 비활동으로 인해 비활성화되었으며, 더는 복구할 수 없습니다.","Akaun ini telah dinyahdayakan kerana tiada aktiviti dan tidak boleh dipulihkan lagi.","Dit account is verwijderd wegens inactiviteit en kan niet meer worden hersteld.","Denne kontoen er blitt deaktivert på grunn av inaktivitet. Den kan ikke gjenopprettes.","Esta conta foi desativada por inatividade e não pode mais ser recuperada.","Эта учетная запись отключена в связи с неактивностью и не может быть восстановлена.","บัญชีนี้ถูกปิดการใช้งานเนื่องจากไม่มีการเคลื่อนไหวและไม่สามารถกู้คืนได้อีกต่อไป","Bu hesap, uzun süredir etkin olmadığı için devre dışı bırakıldı ve kurtarılamaz.","Tài khoản này đã bị vô hiệu hóa do không hoạt động và không thể phục hồi được nữa."
"TID_ACCOUNT_DISABLED_TEXT","Account Disabled","تعطيل الحساب","账号被永久关闭","帳號已被永久刪除","Konto wurde deaktiviert.","Cuenta inhabilitada","حساب غیرفعال شد","Tili poistettu käytöstä","Compte désactivé","Akun Dinonaktifkan","Account disattivato","アカウントが無効化されました","계정 비활성화","Akaun Dinyahdayakan","Account verwijderd","Konto deaktivert","Conta desativada","Учетная запись отключена","ปิดใช้งานบัญชีแล้ว","Hesap Devre Dışı Bırakıldı","Tài khoản này đã bị vô hiệu hóa"
"TID_NOTES_LAST_EDITED","Last edited by: <cffffff><name></c>","آخر تعديل بواسطة: <cffffff><name></c>","最后编辑：<cffffff><name></c>","最後編輯：<cffffff><name></c>","Zuletzt bearbeitet von: <cffffff><name></c>","Última edición: <cffffff><name></c>","آخرین ویرایش توسط: <cffffff><name></c>","Viimeksi muokannut: <cffffff><name></c>","Dernière modification : <cffffff><name></c>","Terakhir diedit oleh: <cffffff><name></c>","Ultima modifica di: <cffffff><name></c>","最終編集：<cffffff><name></c>","마지막 수정: <cffffff><name></c>","Kali terakhir diedit oleh: <cffffff><name></c>","Laatst aangepast door: <cffffff><name></c>","Sist redigert av: <cffffff><name></c>","Última edição: <cffffff><name></c>","Автор последнего изменения: <cffffff><name></c>","แก้ไขครั้งสุดท้ายโดย: <cffffff><name></c>","Son düzenleyen: <cffffff><name></c>","Chỉnh sửa lần cuối bởi: <cffffff><name></c>"
"TID_DIAMOND_BUNDLE_TH4_UPDATED_INFO","• Air Defense level 2\n• <res0> Gold\n• <res1> Elixir\n• <gems> Gems\n\nNo storage limits!\n\nDon't miss this <cffec78><value>X value</c> ONE time offer!","• دفاع جوي مستوى 2\n• <res0> ذهب\n• <res1> إكسير\n• <gems> جواهر\n\nلا توجد حدود للتخزين!\n\nلا تفوت هذا العرض الذي يمنح <cffec78><value> من أمثال القيمة</c> ويأتي مرة واحدة!","• 2级防空火箭\n• <res0>金币\n• <res1>圣水\n• <gems>宝石\n\n存放礼包中的物品不受最大储量限制！\n\n该<cffec78><value>倍超值礼包</c>只可购买\n一次，千万不要错过哦！","• 2級防空火箭\n• <res0>金幣\n• <res1>聖水\n• <gems>寶石\n\n存放特惠包中的物品不受最大儲存量限制！\n\n此<cffec78><value>倍超值特惠包</c>只可購買\n一次，千萬不要錯過喔！","• Luftabwehr Level 2\n• <res0> Gold\n• <res1> Elixier\n• <gems> Juwelen\n\nKein Lagerlimit!\n\nVerpasse nicht dieses EINMALIGE Angebot mit <cffec78><value>-fachem Wert</c>!","• Cohetes de defensa de nivel 2\n• <res0> de oro\n• <res1> de elixir\n• <gems> gemas\n\n¡Sin límite de almacenaje!\n\n¡No te pierdas esta oferta única <cffec78><value></c> veces más barata!","• دفاع هوایی سطح 2\n• <res0> طلا\n• <res1> اکسیر\n• <gems> جواهر\n\nبدون محدودیت ذخیره‌سازی!\n\nاین پیشنهاد یک‌باره به ارزش <cffec78><value> برابر</c> را از دست ندهید!","• Tason 2 ilmatorjunta\n• <res0> kultaa\n• <res1> eliksiiriä\n• <gems> jalokiveä\n\nEi varastointirajoja!\n\nÄlä ohita tätä <cffec78><value>-kertaisen arvoista</c> ainutkertaista tarjousta!","• Défense anti-aérienne niveau 2\n• <res0> pièces d'or\n• <res1> doses d'élixir\n• <gems> gemmes\n\nAucune limite de stockage !\n\nNe ratez pas cette <cffec78>offre unique de valeur X<value></c> !","• Pertahanan Udara level 2\n• <res0> Emas\n• <res1>Eliksir\n• <gems> Permata\n\nTanpa batas penyimpanan!\n\nJangan lewatkan penawaran SATU kali bernilai <cffec78><value>X</c> ini!","• Difesa aerea livello 2\n• <res0> oro\n• <res1> elisir\n• <gems> gemme\n\nNessun limite per i depositi!\n\nNon perderti questa offerta UNICA dal <cffec78>valore moltiplicato per <value></c>!","• 対空砲 (レベル2)\n• <res0>ゴールド\n• <res1>エリクサー\n• <gems>エメラルド\n\n収容量制限なし！\n\nこの初回限定<cffec78><value>倍バリューチャンス</c>をお見逃しなく！!","• 대공포 2레벨\n• <res0> 골드\n• <res1> 엘릭서\n• 보석 <gems> 개\n\n보관량 제한 없음!\n\n이번 한 번 뿐인 <cffec78><value>배 가치</c>의 구매 기회를 놓치지 마세요!","• Pertahanan Udara tahap 2\n• <res0> Emas\n• <res1> Eliksir\n• <gems> Permata\n\nTiada had penyimpanan!\n\nJangan terlepas tawaran satu kali <cffec78>bernilai <value>X</c> ini!","• Luchtafweer level 2\n• <res0> goud\n• <res1> elixir\n• <gems> edelstenen\n\nGeen opslaglimieten!\n\nMis deze <cffec78><value>x zo voordelige</c> en EENMALIGE aanbieding niet!","• Luftforsvar på nivå 2\n• <res0> gull\n• <res1> eliksir\n• <gems> juveler\n\nIngen lagringsbegrensninger!\n\nIkke gå glipp av dette engangstilbudet med <cffec78><value>X</c> høyere verdi!","• Defesa aérea nível 2\n• <res0> Ouro\n• <res1> de elixir\n• <gems> Gemas\n\nSem limite de armazenamento!\n\nNão perca esta oferta única! <cffec78><value>x mais barata</c>!","• Воздушная оборона 2-го уровня.\n• Золото — <res0>.\n• Эликсир — <res1>.\n• Кристаллы — <gems>.\n\nНе требует места в хранилище!\n\nЭтот набор выгоднее в <cffec78><value> р.</c> и доступен лишь однажды!","• การป้องกันทางอากาศเลเวล 2\n• ทองคำ <res0> เหรียญ\n• น้ำอมฤต <res1> หยด\n• อัญมณี <gems> เม็ด\n\nคลังไม่จำกัด!\n\nอย่าพลาดข้อเสนอ <cffec78> มูลค่า X<value></c> เพียงครั้งเดียวนี้","• Hava Savunması 2. seviye\n• <res0> Altın\n• <res1> İksir\n• <gems> Taş\n\nDepo sınırı yok!\n\n <cffec78><value>kat değerli</c> bu TEK seferlik fırsatı kaçırma!","• Tháp Phòng không cấp 2\n• <res0> Vàng\n• <res1> Tiên dược\n• <gems> Ngọc\n\nKhông giới hạn lưu trữ!\n\nĐừng bỏ lỡ ưu đãi MỘT lần <cffec78><value>X giá trị</c> này nhé!"
