"TID","EN","AR","CN","CNT","DE","ES","FA","FI","FR","ID","IT","JP","KR","MS","NL","NO","PT","RU","TH","TR","VI"
"string","string","string","string","string","string","string","string","string","string","string","string","string","string","string","string","string","string","string","string","string","string"
"TID_NEWS_MAR_2018_UPDATE_TITLE","The spring update is here!","وصل تحديث الربيع!","春季更新来啦！","春季更新來啦！","Das Frühlingsupdate ist da!","¡Ya está aquí la nueva actualización!","به‌روزرسانی بهار از راه رسیده است!","Kevään päivitys on täällä!","C'est la mise à jour du printemps !","Pembaruan musim semi telah hadir!","Ecco l'aggiornamento primaverile!","春のアップデートが到着しました！","따뜻한 봄 업데이트가 도착했습니다!","Kemas kini musim bunga dah tiba!","De lente-update is er!","Våroppdateringen er her!","Chegou a nova atualização!","Встречайте весенне обновление!","อัปเดตฤดูใบไม้ผลิมาแล้ว!","Bahar güncellemesi çıktı!","Bản cập nhật mùa xuân đã ra mắt!"
"TID_NEWS_MAR_2018_UPDATE_1","• Builder Hall 8 has arrived along with new deadly weapons, the Mega Tesla and the Super P.E.K.K.A!\n• A mystical Trader with a daily selection of magical goods has arrived in the Home Village\n • The update also includes new Magic Items, new Clan Games Challenges and much more!","• وصلت قاعة البنّاء 8، ومعها أسلحة فتاكة جديدة: تيسلا العملاقة، وبيكا الخارق!\n• هناك تاجر روحاني وصل إلى القرية الأم، ويعرض مجموعة يومية من السلع السحرية.\n• يشمل التحديث أيضًا عناصر سحر جديدة، وتحديات جديدة في مباريات القبيلة، وغيرها المزيد!","• 8级建筑大师大本营隆重登场，解锁强大无比的超级特斯拉电磁塔和超级皮卡！\n• 神秘商人造访家乡村庄，每天都将带来各种魔法物品\n• 还将推出全新魔法物品，全新部落竞赛挑战及更多精彩内容！","• 8級建築大師大本營隆重推出，解鎖終極致命的超級皮卡和超級特斯拉電磁塔！\n• 神秘商人造訪家鄉村莊，每天將帶來各種魔法物品\n• 魔法物品全面升級，還有全新部落競賽挑戰及更多精彩內容！","• Meisterhütte Level 8 und zwei neue, tödliche Waffen – Megatesla und Super-P.E.K.K.A. – wurden hinzugefügt!\n • Ein mystischer Händler mit einer täglich neuen Auswahl an magischen Waren hat im Heimatdorf sein Lager aufgeschlagen.\n • In diesem Update erwarten dich außerdem neue magische Gegenstände, neue Clanspiel-Herausforderungen und vieles mehr!","• Ya está disponible el taller del constructor de nivel 8 y viene con nuevas armas, la megatorre Tesla y el súper P.E.K.K.A.\n• Un misterioso mercader ha llegado a la aldea y trae consigo una selección diaria de objetos mágicos.\n• ¡Esta actualización también incluye nuevos objetos mágicos, desafíos de los Juegos del Clan y mucho más!","• تالار سازنده سطح 8 همراه با سلاح‌های مهلک جدید، مگا تسلا و سوپر P.E.K.K.A!\n• حضور بازرگانی مرموز با مجموعه‌ای روزانه از اجناس جادویی در دهکده خانه\n• به‌روزرسانی همچنین شامل عتیقه‌های جادویی جدید، چالش‌های بازی‌های قبیله‌ای و موارد بیشتر است!","• Rakentajan talon taso 8 on saapunut ja sen mukana tulevat tuhoisat uutuudet megatesla ja super-P.E.K.K.A.!\n• Salaperäinen kauppias on ilmestynyt kotikylän laitamille kaupittelemaan päivittäisiä taikaesinetarjouksiaan.\n• Päivitys sisältää myös uusia taikaesineitä, klaanikisojen haasteita ja paljon muuta!","• La maison des ouvriers niveau 8 est arrivée avec de nouvelles armes, le super P.E.K.K.A et la méga tesla.\n • Un marchand arrive dans votre village principal avec toute une sélection de marchandises mystiques.\n • La mise à jour comporte aussi de nouveaux objets magiques, de nouveaux défis pour les jeux de clan et encore bien plus !","• Aula Tukang level 8 hadir dengan senjata mematikan baru, Tesla Mega dan P.E.K.K.A Super!\n• Pedagang mistis akan datang setiap hari menawarkan barang dagangan sihir pilihan di Desa Asal\n• Pembaruan ini juga menghadirkan Barang Sihir baru, Tantangan Permainan Klan baru, dan masih banyak lagi!","• Arriva la sala del costruttore 8 con nuove armi letali, la mega Tesla e la super P.E.K.K.A!\n• Un mercante misterioso è in visita al villaggio e ti offrirà una selezione giornaliera di prodotti magici.\n• Nuovi artefatti, nuove sfide nei giochi del clan e altro ancora!","• ビルダーホールレベル8が新たな最強ユニット、メガテスラとスーパーP.E.K.K.Aを引き連れて登場！\n• 謎のトレーダーが日替わりの魔法グッズを持って自分の村にやって来ました！\n• 新たな魔法アイテムやクランゲームのチャレンジなど、その他新コンテンツが盛りだくさん！","• 장인회관 8레벨이 추가됩니다! 강력한 무기인 메가 뇌전탑과 슈퍼 P.E.K.K.A를 함께 만나보세요!\n• 신비한 거래상이 매일 특별한 마법 아이템을 가지고 마을을 방문합니다.\n• 신규 마법 아이템, 새로운 클랜 게임 도전 등 다양한 업데이트 내용을 만나보세요!","• Dewan Bandaran 8 dan senjata membawa maut baharu - Tesla Besar dan P.E.K.K.A Super!\n• Pedagang mistik dengan pilihan item ajaib harian telah tiba di Kampung Asal\n• Kemas kini ini juga termasuk Item Ajaib baharu, Permainan Klan baharu dan banyak lagi","• Bouwerszaallevel 8 is er samen met nieuwe dodelijke wapens: de mega-Tesla en de super-P.E.K.K.A.\n• Een mysterieuze handelaar met een dagelijkse selectie aan magische goederen is aangekomen in je thuisdorp.\n• De update bevat ook nieuwe magische artefacten, nieuwe uitdagingen voor de clanspelen en veel meer!","• Byggerens hall 8 har kommet, og den har med seg to dødbringende nye våpen: megatesla og super-Pekka!\n• En mystisk kremmer med et daglig utvalg magiske varer har ankommet hjemlandsbyen\n• Oppdateringen inneholder også nye magiske gjenstander, nye klanleker-utfordringer og mer!","• Conheça a Casa do Construtor 8, a megatesla e a Super P.E.K.K.A!\n• Sua vila principal receberá a visita diária de um comerciante misterioso com uma seleção de itens mágicos à venda.\n• A atualização também traz novos itens mágicos, desafios dos Jogos do Clã e muito mais!","• Дом строителя 8-го уровня, новое смертельное оружие, мегатесла и суперП.Е.К.К.А.!\n• Таинственный торговец с ежедневным ассортиментом магических товаров прибыл в вашу родную деревню.\n• А также волшебные предметы, новые испытания в Играх кланов и многое другое!","• หอช่างก่อสร้างเลเวล 8 มาถึงพร้อมกับอาวุธมรณะแบบใหม่ เทสลามหาประลัยและสุดยอด P.E.K.K.A.!\n• พ่อค้าลี้ลับกับสินค้าเวทมนตร์ที่คัดสรรกันวันต่อวันได้มาถึงหมู่บ้านหลักแล้ว\n• นอกจากนี้ อัปเดตยังมีไอเทมเวทมนตร์ใหม่ๆ, ความท้าทายเกมแคลนใหม่ๆ และอื่นๆ อีกมากมาย!","• 8. seviye İnşaatçı Binası ve yeni, ölümcül silahlar Mega Tesla ve Süper P:EK.K.A geldi!\n• Asıl köye de her gün farklı büyülü ürünler satan gizemli bir Tüccar geliyor.\n• Güncellemede ayrıca yeni Büyülü Öğeler, yeni Klan Oyunları mücadeleleri ve daha fazlası var!","• Hội trường Thợ xây cấp 8 đã xuất hiện cùng với những vũ khí cực kỳ nguy hiểm là Tháp Hồ quang điện Siêu cấp và Siêu P.E.K.K.A!\n• Một vị Thương gia bí ẩn đã xuất hiện ở Làng Chính và sẽ mang đến cho bạn các ưu đãi hàng ngày về vật phẩm ma thuật\n• Bản cập nhật cũng có thêm các Vật phẩm Thần kỳ mới, các Thử thách Trò chơi Hội mới và nhiều nội dung khác nữa!"
"CLAN_GAMES_BUILDER_THEME","Builder Games","مباريات البنّاء","建筑大师基地竞赛","建築大師基地競賽","Bauarbeiter\nSpiele","Juegos del Constructor","بازی‌های سازنده","Rakentajan kisat","Jeux de l'ouvrier","Permainan Tukang","Giochi del costruttore","大工ゲーム","장인 게임","Permainan Pembina","Bouwers-\nspelen","Byggerens leker","Jogos do Construtor","Игры строителя","เกมช่างก่อสร้าง","İnşaatçı Oyunları","Trò chơi\nThợ xây"
"TID_DIAMOND_BUNDLE_TH4_INFO","• <gems> Gems\n• <res0> Gold\n• Air Defense level 1\n\nNo building time, no storage limits!\n\nDon't miss this <cffec78><value>X value</c> ONE time offer!","• <gems> من الجواهر\n• <res0> من الذهب\n• دفاع جوي من المستوى 1\n\nبدون وقت للبناء وبلا حدود على التخزين!\n\nلا تفوّت هذا العرض الذي يعطي <cffec78><value> أضعاف القيمة</c> ويأتي مرة واحدة!","• <gems>宝石\n• <res0>金币\n• 1级防空火箭\n\n礼包中的建筑无需花费建造时间，存放礼包中的资源不受最大储量限制！\n\n该<cffec78><value>倍超值礼包</c>只可购买\n一次，千万不要错过哦！","• <gems>寶石\n• <res0>金幣\n• 1級防空火箭\n\n超值包中的建築無需花費建造時間，存放超值包中的資源不受最大儲存量限制！\n\n該<cffec78><value>倍超值包</c>只可購買\n一次，千萬不要錯過喔！","• <gems> Juwelen\n• <res0> Gold\n• Luftabwehr Level 1\n\nSofortige Fertigstellung, kein Lagerlimit!\n\nVerpasse nicht dieses EINMALIGE Angebot mit <cffec78><value>-fachem Wert</c>!","• <gems> gemas\n• <res0> de oro\n• Cohetes de defensa de nivel 1\n\n¡Sin tiempo de construcción ni límite de almacenaje!\n\n¡No te pierdas esta oferta única <cffec78><value> veces más barata</c>!","• <gems> جواهر\n• <res0> طلا\n• دفاع هوایی سطح ۲\n\nبدون نیاز به صرف زمان برای ساخت، و بدون محدودیت ذخیره‌سازی!\n\nاین پیشنهاد به ارزش <cffec78><value>X</c> فقط یک بار اتفاق می‌افتد؛ آن را از دست ندهید!","• <gems> jalokiveä\n• <res0> kultaa\n• Tason 1 ilmatorjunta\n\nEi rakennusaikoja eikä varastointirajoja!\n\nÄlä ohita tätä\n<cffec78><value>-kertaisen arvoista</c> ainutkertaista tarjousta!","• <gems> gemmes\n• <res0> pièces d'or\n• Défense anti-aérienne niveau 1\n\nAucune durée de construction, aucune limite de stockage !\n\nNe manquez pas cette <cffec78>offre UNIQUE de valeur X<value></c> !","• <gems> Permata\n• <res0> Emas\n• Pertahanan Udara level 1\n\nTanpa waktu pembangunan, tanpa batas penyimpanan!\n\nJangan lewatkan penawaran SATU kali bernilai <cffec78><value>X</c> ini!","• <gems> gemme\n• <res0> oro\n• Difesa aerea livello 1\n\nNessun tempo di costruzione, nessun limite per i depositi!\n\nNon perderti questa offerta UNICA dal <cffec78>valore moltiplicato per <value></c>!","• <gems>エメラルド\n• <res0>ゴールド\n• レベル1対空砲\n\n建設時間なし、収容量制限なし！\n\nこの<cffec78><value>xバリュー</c>のスターターパックは、1度きりの限定提供となります！","• 보석 <gems>개\n• <res0> 골드\n• 바람 방출기 1레벨\n\n즉시 건설할 수 있고 저장소 한도가 없습니다!\n\n이번 한 번뿐인 <cffec78><value>배 가치</c>의 구매 기회를 놓치지 마세요!","• <gems> Permata\n• <res0> Emas\n• Pertahanan Udara tahap 1\n\nTiada masa pembinaan, tiada had penyimpanan!\n\nJangan ketinggalan <cffec78><value>nilai X</c> ini ialah tawaran SATU kali!","• <gems> edelstenen\n• <res0> goud\n• Luchtafweer level 1\n\nGeen bouwtijd, geen opslaglimieten!\n\nMis deze <cffec78><value>x zo voordelige</c> en EENMALIGE aanbieding niet!","• <gems> Juveler\n• <res0> Gull\n• Luftforsvar på nivå 1\n\nIngen byggetid, ingen lagringsbegrensninger!\n\nIkke gå glipp av dette engangstilbudet med <cffec78><value>X høyere verdi</c>!","• <gems> Gemas\n• <res0> Ouro\n• Defesa Aérea nível 1\n\nSem tempo de construção, sem limite de armazenamento!\n\nNão perca esta oferta única! <cffec78><value>X mais barato</c>.","• Кристаллы — <gems>.\n• Золото — <res0>.\n• Воздушная оборона 1-го уровня.\n\nСтроится мгновенно и без ограничений!\n\nЭтот набор выгоднее в <cffec78><value> р.</c> и доступен лишь однажды!","• อัญมณี <gems> เม็ด\n• ทองคำ <res0> เหรียญ\n• การป้องกันทางอากาศเลเวล 1\n\nไม่มีช่วงเวลาสร้าง ไม่มีขีดจำกัดคลัง!\n\nอย่าพลาดข้อเสนอ <cffec78>มูลค่า X<value></c> เพียงครั้งเดียวนี้!","• <gems> Taş\n• <res0> Altın\n• 1. seviye Hava Savunması\n\nİnşa süresi ve depo sınırı yok!\n\n<cffec78><value> kat değerli</c> bu TEK seferlik fırsatı kaçırma!","• <gems> Ngọc\n• <res0> Vàng\n• Tháp Phòng không cấp 1\n\nKhông có thời gian xây dựng, không có giới hạn lưu trữ!\n\nĐừng bỏ lỡ ưu đãi MỘT lần <cffec78><value>X giá trị</c> này!"
"TID_DIAMOND_BUNDLE_TH5_INFO","• <gems> Gems\n• <res0> Gold\n• Wizard Tower level 1\n\nNo building time, no storage limits!\n\nDon't miss this <cffec78><value>X value</c> ONE time offer!","• <gems> من الجواهر\n• <res0> من الذهب\n• برج الساحر من المستوى 1\n\nبدون وقت للبناء وبلا حدود على التخزين!\n\nلا تفوّت هذا العرض الذي يعطي <cffec78><value> أضعاف القيمة</c> ويأتي مرة واحدة!","• <gems>宝石\n• <res0>金币\n• 1级法师塔\n\n礼包中的建筑无需花费建造时间，存放礼包中的资源不受最大储量限制！\n\n该<cffec78><value>倍超值礼包</c>只可购买\n一次，千万不要错过哦！","• <gems>寶石\n• <res0>金幣\n• 1級法師塔\n\n超值包中的建築無需花費建造時間，存放超值包中的資源不受最大儲存量限制！\n\n該<cffec78><value>倍超值包</c>只可購買\n一次，千萬不要錯過喔！","• <gems> Juwelen\n• <res0> Gold\n• Magierturm Level 1\n\nSofortige Fertigstellung, kein Lagerlimit!\n\nVerpasse nicht dieses EINMALIGE Angebot mit <cffec78><value>-fachem Wert</c>!","• <gems> gemas\n• <res0> de oro\n• Torre de mago de nivel 1\n\n¡Sin tiempo de construcción ni límite de almacenaje!\n\n¡No te pierdas esta oferta única <cffec78><value> veces más barata</c>!","• <gems> جواهر\n• <res0> طلا\n• برج جادوگر سطح ۲\n\nبدون نیاز به صرف زمان برای ساخت، و بدون محدودیت ذخیره‌سازی!\n\nاین پیشنهاد به ارزش <cffec78><value>X</c> فقط یک بار اتفاق می‌افتد؛ آن را از دست ندهید!","• <gems> jalokiveä\n• <res0> kultaa\n• Tason 1 velhotorni\n\nEi rakennusaikoja eikä varastointirajoja!\n\nÄlä ohita tätä\n<cffec78><value>-kertaisen arvoista</c> ainutkertaista tarjousta!","• <gems> gemmes\n• <res0> pièces d'or\n• Tour de sorciers niveau 1\n\nAucune durée de construction, aucune limite de stockage !\n\nNe manquez pas cette <cffec78>offre UNIQUE de valeur X<value></c> !","• <gems> Permata\n• <res0> Emas\n• Menara Penyihir level 1\n\nTanpa waktu pembangunan, tanpa batas penyimpanan!\n\nJangan lewatkan penawaran SATU kali bernilai <cffec78><value>X</c> ini!","• <gems> gemme\n• <res0> oro\n• Torre dello stregone livello 1\n\nNessun tempo di costruzione, nessun limite per i depositi!\n\nNon perderti questa offerta UNICA dal <cffec78>valore moltiplicato per <value></c>!","• <gems>エメラルド\n• <res0>ゴールド\n• レベル1ウィザードの塔\n\n建設時間なし、収容量制限なし！\n\nこの<cffec78><value>xバリュー</c>のスターターパックは、1度きりの限定提供となります！","• 보석 <gems>개\n• <res0> 골드\n• 마법사 타워 1레벨\n\n즉시 건설할 수 있고 저장소 한도가 없습니다!\n\n이번 한 번뿐인 <cffec78><value>배 가치</c>의 구매 기회를 놓치지 마세요!","• <gems> Permata\n• <res0> Emas\n• Menara Ahli Sihir tahap 1\n\nTiada masa pembinaan, tiada had penyimpanan!\n\nJangan ketinggalan <cffec78><value>nilai X</c> ini ialah tawaran SATU kali!","• <gems> edelstenen\n• <res0> goud\n• Tovenaarstoren level 1\n\nGeen bouwtijd, geen opslaglimieten!\n\nMis deze <cffec78><value>x zo voordelige</c> en EENMALIGE aanbieding niet!","• <gems> Juveler\n• <res0> Gull\n• Trollmannstårn på nivå 1\n\nIngen byggetid, ingen lagringsbegrensninger!\n\nIkke gå glipp av dette engangstilbudet med <cffec78><value>X høyere verdi</c>!","• <gems> Gemas\n• <res0> Ouro\n• Torre do Mago nível 1\n\nSem tempo de construção, sem limite de armazenamento!\n\nNão perca esta oferta única! <cffec78><value>X mais barato</c>.","• Кристаллы — <gems>.\n• Золото — <res0>.\n• Башня колдуна 1-го уровня.\n\nСтроится мгновенно и без ограничений!\n\nЭтот набор выгоднее в <cffec78><value> р.</c> и доступен лишь однажды!","• อัญมณี <gems> เม็ด\n• ทองคำ <res0> เหรียญ\n• หอคอยพ่อมดเลเวล 1\n\nไม่มีช่วงเวลาสร้าง ไม่มีขีดจำกัดคลัง!\n\nอย่าพลาดข้อเสนอ <cffec78>มูลค่า X<value></c> เพียงครั้งเดียวนี้!","• <gems> Taş\n• <res0> Altın\n• 1. seviye Büyücü Kulesi\n\nİnşa süresi ve depo sınırı yok!\n\n<cffec78><value> kat değerli</c> bu TEK seferlik fırsatı kaçırma!","• <gems> Ngọc\n• <res0> Vàng\n• Tháp Pháp sư cấp 1\n\nKhông có thời gian xây dựng, không có giới hạn lưu trữ!\n\nĐừng bỏ lỡ ưu đãi MỘT lần <cffec78><value>X giá trị</c> này!"
"TID_DIAMOND_BUNDLE_TH6_INFO","• <gems> Gems\n• <res0> Gold\n• Air Sweeper level 1\n\nNo building time, no storage limits!\n\nDon't miss this <cffec78><value>X value</c> ONE time offer!","• <gems> من الجواهر\n• <res0> من الذهب\n• كنّاس جوي من المستوى 1\n\nبدون وقت للبناء وبلا حدود على التخزين!\n\nلا تفوّت هذا العرض الذي يعطي <cffec78><value> أضعاف القيمة</c> ويأتي لمرة واحدة!","• <gems>宝石\n• <res0>金币\n• 1级空气炮\n\n礼包中的建筑无需花费建造时间，存放礼包中的资源不受最大储量限制！\n\n该<cffec78><value>倍超值礼包</c>只可购买\n一次，千万不要错过哦！","• <gems>寶石\n• <res0>金幣\n• 1級空氣炮\n\n超值包中的建築無需花費建造時間，存放超值包中的資源不受最大儲存量限制！\n\n該<cffec78><value>倍超值包</c>只可購買\n一次，千萬不要錯過喔！","• <gems> Juwelen\n• <res0> Gold\n• Luftfeger Level 1\n\nSofortige Fertigstellung, kein Lagerlimit!\n\nVerpasse nicht dieses EINMALIGE Angebot mit <cffec78><value>-fachem Wert</c>!","• <gems> gemas\n• <res0> de oro\n• Controlador aéreo de nivel 1\n\n¡Sin tiempo de construcción ni límite de almacenaje!\n\n¡No te pierdas esta oferta única <cffec78><value> veces más barata</c>!","• <gems> جواهر\n• <res0> طلا\n• جاروی هوایی سطح ۲\n\nبدون نیاز به صرف زمان برای ساخت، و بدون محدودیت ذخیره‌سازی!\n\nاین پیشنهاد به ارزش <cffec78><value>X</c> فقط یک بار اتفاق می‌افتد؛ آن را از دست ندهید!","• <gems> jalokiveä\n• <res0> kultaa\n• Tason 1 puhallin\n\nEi rakennusaikoja eikä varastointirajoja!\n\nÄlä ohita tätä\n<cffec78><value>-kertaisen arvoista</c> ainutkertaista tarjousta!","• <gems> gemmes\n• <res0> pièces d'or\n• Propulseur d'air niveau 1\n\nAucune durée de construction, aucune limite de stockage !\n\nNe manquez pas cette <cffec78>offre UNIQUE de valeur X<value></c> !","• <gems> Permata\n• <res0> Emas\n• Penyapu Udara level 1\n\nTanpa waktu pembangunan, tanpa batas penyimpanan!\n\nJangan lewatkan penawaran SATU kali bernilai <cffec78><value>X</c> ini!","• <gems> gemme\n• <res0> oro\n• Volanò livello 1\n\nNessun tempo di costruzione, nessun limite per i depositi!\n\nNon perderti questa offerta UNICA dal <cffec78>valore moltiplicato per <value></c>!","• <gems>エメラルド\n• <res0>ゴールド\n• レベル1エアスイーパー\n\n建設時間なし、収容量制限なし！\n\nこの<cffec78><value>xバリュー</c>のスターターパックは、1度きりの限定提供となります！","• 보석 <gems>개\n• <res0> 골드\n• 바람 방출기 1레벨\n\n즉시 건설할 수 있고 저장소 한도가 없습니다!\n\n이번 한 번뿐인 <cffec78><value>배 가치</c>의 구매 기회를 놓치지 마세요!","• <gems> Permata\n• <res0> Emas\n• Penyapu Udara tahap 1\n\nTiada masa pembinaan, tiada had penyimpanan!\n\nJangan ketinggalan <cffec78><value>nilai X</c> ini ialah tawaran SATU kali!","• <gems> edelstenen\n• <res0> goud\n• Windmachine level 1\n\nGeen bouwtijd, geen opslaglimieten!\n\nMis deze <cffec78><value>x zo voordelige</c> en EENMALIGE aanbieding niet!","• <gems> Juveler\n• <res0> Gull\n• Luftblåsere på nivå 1\n\nIngen byggetid, ingen lagringsbegrensninger!\n\nIkke gå glipp av dette engangstilbudet med <cffec78><value>X høyere verdi</c>!","• <gems> Gemas\n• <res0> Ouro\n• Dispersor Aéreo nível 1\n\nSem tempo de construção, sem limite de armazenamento!\n\nNão perca esta oferta única! <cffec78><value>X mais barato</c>.","• Кристаллы — <gems>.\n• Золото — <res0>.\n• Чистильщик 1-го уровня.\n\nСтроится мгновенно и без ограничений!\n\nЭтот набор выгоднее в <cffec78><value> р.</c> и доступен лишь однажды!","• อัญมณี <gems> เม็ด\n• ทองคำ <res0> เหรียญ\n• เครื่องกวาดอากาศเลเวล 1\n\nไม่มีช่วงเวลาสร้าง ไม่มีขีดจำกัดคลัง!\n\nอย่าพลาดข้อเสนอ <cffec78>มูลค่า X<value></c> เพียงครั้งเดียวนี้!","• <gems> Taş\n• <res0> Altın\n• 1. seviye Hava Patlatıcı\n\nİnşa süresi ve depo sınırı yok!\n\n<cffec78><value> kat değerli</c> bu TEK seferlik fırsatı kaçırma!","• <gems> Ngọc\n• <res0> Vàng\n• Tháp Thổi khí cấp 1\n\nKhông có thời gian xây dựng, không có giới hạn lưu trữ!\n\nĐừng bỏ lỡ ưu đãi MỘT lần <cffec78><value>X giá trị </c> này!"
