"TID","EN","AR","CN","CNT","DE","ES","FA","FI","FR","ID","IT","JP","KR","MS","NL","NO","PT","RU","TH","TR","VI"
"TID_DIAMOND_BUNDLE_MAGICITEMS_HEROES_BOOK_WITH_DARK_ELIXIR_INFO","• <res0> Dark Elixir \n• <booster1>x Book of Heroes\n• No storage limits!\n\nEverything you need for upgrading your Barbarian King and Archer Queen!","• <res0> إكسير الظلام \n• <booster1>x كتاب الأبطال\n• لا حدود للتخزين!\n\nكل ما تحتاجه لترقية الملك البربري والملكة رامية السهام!","• <res0>暗黑重油\n• <booster1>本英雄之书\n• 存放礼包中的物品不受最大储量限制！\n\n包含升级野蛮人之王或弓箭女皇所需的一切！","• <res0>闇黑重油\n• <booster1>本英雄之書\n• 存放特惠包中的物品不受最大儲存量限制！\n\n包含升級野蠻人之王或弓箭女皇所需的一切！","• <res0> Dunkles Elixier \n• <booster1>x Buch der Helden\n• Kein Lagerlimit!\n\nAlles, was du brauchst, um deinen Barbarenkönig oder deine Bogenschützen-Königin zu verbessern!","• <res0> de elixir oscuro\n• <booster1>x libro de héroes\n• ¡Sin límite de almacenaje!\n\n¡Todo lo que necesitas para mejorar a tu rey bárbaro y tu reina arquera!","• <res0> اکسیر سیاه\n• <booster1> کتاب قهرمانان\n• بدون محدودیت ذخیره‌سازی!\n\nهمه آنچه برای ارتقاء شاه بربرها و ملکه کماندار نیاز دارید!","• <res0> mustaa eliksiiriä \n• <booster1> sankareiden kirjaa\n• Ei varastointirajoja!\n\nKaikki mitä tarvitset barbaarikuninkaasi ja jousikuningattaresi päivittämistä varten!","• <res0> unités d'élixir noir\n• Livre des héros x<booster1>\n\n• Pas de limite de stockage !\n\nTout ce qu'il vous faut pour améliorer le roi des barbares et la reine des archers.","• <res0> Eliksir Hitam\n• <booster1>x Kitab Pahlawan\n• Tanpa batas penyimpanan!\n\nSemua yang diperlukan untuk meningkatkan Raja Barbar atau Ratu Pemanah!","• <res0> elisir nero \n• Libri degli eroi: <booster1>\n• Nessun limite dei depositi!\n\n Ciò di cui hai bisogno per migliorare re barbaro e regina degli arcieri!","• <res0>ダークエリクサー\n• ヒーローの本<booster1>冊\n• 収容量制限なし！\n\nバーバリアンキングやアーチャークイーンのアップグレードに必要なものが全部入っています！","• <res0> 다크 엘릭서\n• 영웅의 책 <booster1>개\n• 보관량 제한 없음!\n\n바바리안 킹과 아처 퀸 업그레이드에 필요한 모든 것!","• <res0> Eliksir Kejahatan \n• <booster1>x Buku Wira-Wira\n• Tiada had penyimpanan!\n\nSemua yang anda perlukan untuk menaik taraf Raja Orang Gasar dan Permaisuri Pemanah anda!","• <res0> duister-elixir\n• <booster1>x het heldenboek\n• Geen opslaglimieten!\n\nAlles wat je nodig hebt om je barbarenkoning en boogschutterskoningin te upgraden.","• <res0> mørke eliksirer\n• <booster1>x heltebok\n• Ingen lagringsbegrensninger!\n\nAlt du trenger for å oppgradere barbarkongen og bueskytterdronningen!","• <res0> de elixir negro\n• <booster1>x Livro dos Heróis\n• Sem limite de armazenamento!\n\nÉ a chance de melhorar seu Rei Bárbaro ou sua Rainha Arqueira!","• Черный эликсир (<res0>).\n• Книга героев (<booster1>).\n• Не зависит от места в хранилище!\n\nВсе, что нужно для улучшения короля варваров и королевы лучниц!","• น้ำอมฤตมืด <res0> หยด\n• ตำราผู้กล้า <booster1> เล่ม\n•คลังเก็บไม่จำกัด!\n\nทุกสิ่งที่ต้องใช้ในการอัปเกรดราชันคนเถื่อนและราชินีธนูของคุณ!","• <res0> Kara İksir\n• <booster1> Kahramanlar Kitabı\n• Depolama sınırı yok!\n\nBarbar Kral ve Okçu Kraliçeni yükseltmek için gereken her şey!","• <res0> Hắc Tiên dược \n• <booster1>x Tướng Thư\n• Không có giới hạn lưu trữ!\n\nCó tất cả mọi thứ mà bạn cần để nâng cấp Man di Vương và Nữ hoàng Cung thủ!"
"TID_WARTOOLS_EMPTY_NOTES","Tap to add notes","انقر لإضافة ملاحظاتك","点击添加备注","點擊以新增備註","Tippe, um Notizen hinzuzufügen.","Toca para añadir notas","ضربه برای افزودن یادداشت","Napauta ja lisää muistiinpanoja","Appuyez pour ajouter des notes","Ketuk untuk menambah catatan","Tocca per aggiungere note","タップしてメモを追加","탭해서 메모 입력","Ketik untuk tambah nota","Tik om opmerkingen toe te voegen","Trykk for å legge til notater","Toque para adicionar notas","Коснитесь, чтобы оставить заметку.","แตะเพื่อเพิ่มบันทึก","Not eklemek için dokun","Nhấn để thêm ghi chú"
"TID_WARTOOLS_ATTACK_CONFIRMATION","This target has been claimed by another player. Do you want to attack anyway?","طالب لاعب آخر بهذا الهدف. هل تريد مهاجمته على أية حال؟","该目标已被其他玩家锁定，您仍要发动进攻吗？","該目標已被其他玩家鎖定，您仍要發動進攻嗎？","Dieses Ziel wurde bereits von einem anderen Spieler beansprucht. Möchtest du es trotzdem angreifen?","Este objetivo ya lo ha reclamado otro jugador. ¿Quieres atacarlo de todas formas?","بازیکن دیگری قبلاً این هدف را درخواست کرده است. هنوز می‌خواهید حمله کنید؟","Toinen pelaaja on jo valinnut tämän kohteen. Haluatko hyökätä siitä huolimatta?","Cette cible a déjà été prise par un autre joueur. Voulez-vous vraiment l'attaquer ?","Target ini telah diklaim pemain lain. Masih ingin menyerang?","Questo bersaglio è stato già rivendicato da un altro giocatore. Vuoi attaccarlo lo stesso?","この村は他のプレイヤーから攻撃を宣言されています。本当に攻撃しますか？","해당 목표를 이미 선점한 대장이 있습니다. 그래도 공격할까요?","Sasaran ini telah dituntut oleh pemain lain. Adakah anda ingin menyerang juga?","Dit doelwit is door een andere speler geclaimd. Wil je toch aanvallen?","En annen spiller har allerede gjort krav på målet. Vil du angripe likevel?","Já há outro jogador trabalhando neste alvo. Quer atacar mesmo assim?","Эта цель выбрана другим игроком. Все равно атаковать?","มีผู้เล่นท่านอื่นครอบครองเป้าหมายนี้ไปแล้ว ท่านยังต้องการโจมตีหรือไม่?","Başka bir oyuncu bu hedefi seçmiş. Yine de saldırmak istiyor musun?","Đã có người chơi khác chọn mục tiêu này. Bạn vẫn muốn tấn công chứ?"
"TID_WARTOOLS_CLAIM_TARGET","Claim target","المطالبة بالهدف","锁定目标","鎖定目標","Ziel beanspruchen","Reclamar objetivo","درخواست هدف","Valitse kohde","Prendre la cible","Klaim target","Rivendica bersaglio","攻撃を宣言","목표 선점","Tuntut sasaran","Doelwit claimen","Gjør krav på mål","Escolher alvo","Выбрать цель","ครอบครองเป้าหมายนี้","Hedefi seç","Chọn mục tiêu"
"TID_WARTOOLS_REMOVE_CLAIM","Remove claim","إزالة المطالبة","移除锁定","移除鎖定","Beanspruchung aufheben","Eliminar reclamación","حذف درخواست","Poista valinta","Annuler","Cabut klaim","Rimuovi rivendicazione","宣言を撤回","선점 취소","Batalkan tuntutan","Claim verwijderen","Trekk kravet","Remover alvo","Отменить выбор цели","ยกเลือกการครอบครอง","Seçimi kaldır","Bỏ chọn"
"TID_TARGETS_FULL","Somebody has already claimed this target","طالب أحد اللاعبين بهذا الهدف بالفعل","该目标已被其他玩家锁定","該目標已被其他玩家鎖定","Dieses Ziel wurde bereits von jemandem beansprucht.","Alguien ya ha reclamado este objetivo.","شخص دیگری این هدف را قبلاً درخواست کرده است","Joku on jo valinnut tämän kohteen.","Quelqu'un a déjà pris cette cible","Seseorang telah mengeklaim target ini","Qualcuno ha già rivendicato questo bersaglio","すでに誰かがこの村への攻撃を宣言しています","누군가가 이미 선점한 목표입니다.","Sasaran ini sudah dituntut oleh seseorang","Iemand heeft dit doelwit al geclaimd.","Noen har allerede gjort krav på dette målet","Alguém já está trabalhando neste alvo.","Кто-то уже выбрал эту цель.","มีผู้ครอบครองเป้าหมายนี้ไปแล้ว","Bu hedefi başkası seçmiş","Đã có người chọn mục tiêu này rồi"
"TID_NO_MORE_CALL_FOR_TARGETS","You have already claimed a target","لقد طالبت بهذا الهدف بالفعل","您已经锁定了一个目标","您已經鎖定了一個目標","Du hast bereits ein Ziel beansprucht.","Ya has reclamado un objetivo.","قبلاً هدفی را درخواست کرده‌اید","Olet jo valinnut kohteen.","Vous avez déjà pris une cible","Kamu telah mengeklaim target","Hai già rivendicato un bersaglio","あなたはすでに攻撃を宣言しています","이미 선점한 목표가 있습니다.","Anda sudah menuntut satu sasaran","Je hebt al een doelwit geclaimd.","Du har allerede gjort krav på et mål","Você já escolheu um alvo.","Вы уже выбрали цель.","ท่านครอบครองเป้าหมายไปแล้ว","Zaten bir hedef seçtin","Bạn đã chọn mục tiêu rồi"
"TID_REQUEST_IS_PENDING","Your request is pending","طلبك قيد الانتظار","正在处理您的请求","正在處理您的要求","Deine Anfrage wird bearbeitet.","Tu solicitud está pendiente.","درخواست شما در انتظار است","Pyyntöäsi käsitellään.","Votre requête est en attente","Permintaan sedang ditangguhkan","Richiesta in sospeso","あなたのリクエストは保留中です","요청이 보류 중입니다.","Permintaan anda sedang diuruskan","Je verzoek is in behandeling.","Anmodningen din er under behandling","Sua solicitação está pendente.","Ваш запрос обрабатывается.","คำขอของท่านกำลังรอดำเนินการ","İsteğin beklemede","Yêu cầu của bạn đang chờ xử lý"
"TID_ADVANCED_SETTINGS","More Settings","مزيد من الإعدادات","更多设置","更多設定","Mehr Einstellungen","Más ajustes","سایر تنظیمات","Lisäasetukset","Paramètres supplémentaires","Setelan Lainnya","Altre impostazioni","詳細設定","추가 설정","Lebih Tetapan","Meer instellingen","Flere innstillinger","Mais configurações","Дополнительные настройки","การตั้งค่าเพิ่มเติม","Diğer Ayarlar","Thêm cài đặt"
"TID_ADVANCED_SETTINGS_BUTTON","Show","العرض","显示","顯示","Anzeigen","Mostrar","نمایش","Näytä","Afficher","Tampilkan","Mostra","見る","표시","Tunjukkan","Tonen","Vis","Mostrar","Показать","แสดง","Göster","Hiển thị"
"TID_PERSONALISED_SHOP","Personalised Shop","متجر مخصص","商店个性化推荐","商店專屬推薦","Personalisierter Shop","Tienda personalizada","فروشگاه شخصی‌شده","Räätälöity kauppa","Magasin personnalisé","Toko Disesuaikan","Negozio personalizzato","カスタムショップ","맞춤 상점","Kedai Tersuai","Gepersonaliseerde winkel","Personalisert butikk","Loja personalizada","Персональный магазин","ร้านค้าปรับแต่ง","Kişiye Özel Dükkan","Cửa hàng tùy chỉnh cá nhân"
"TID_ACCOUNT_DELETION_WARNING_TITLE","Account Deletion Warning","تحذير حذف الحساب","账号关闭警告","帳號刪除警告","Warnung zur Kontolöschung","Aviso de eliminación de cuenta","هشدار حذف حساب","Varoitus tilin poistamisesta","Avertissement de suppression de compte","Peringatan Penghapusan Akun","Avviso eliminazione account","アカウント削除のお知らせ","계정 삭제 경고","Amaran Pemadaman Akaun","Waarschuwing wegens verwijderen account","Advarsel om sletting av konto","Aviso de exclusão de conta","Удаление учетной записи","คำเตือนการลบบัญชี","Hesap Silme Uyarısı","Cảnh báo xóa tài khoản"
"TID_ACCOUNT_DELETION_WARNING_TEXT","Following your request your account will be deleted in <time>. If you have changed your mind contact Help and Support to cancel your deletion request.","استجابةً لطلبك سيتم حذف حسابك خلال <time>. إذا غيرت رأيك، فاتصل بالمساعدة والدعم لإلغاء طلب الحذف.","根据您的请求，您的账号将于<time>后被关闭。如果您不希望进行此操作，请在游戏内点击\q帮助与支持\q联系玩家支持团队取消您的请求。","根據您的要求，您的帳號將於<time>後刪除。如果您不希望進行此操作，請在遊戲內點擊\q幫助與支援\q聯繫玩家支援團隊以取消您的要求。","Gemäß deiner Anfrage wird dein Konto in <time> gelöscht werden. Solltest du es dir anders überlegen, kontaktiere bitte den Support, um deine Löschungsanfrage rückgängig zu machen.","Tal y como nos has solicitado, eliminaremos tu cuenta en <time>. Si has cambiado de opinión, ponte en contacto con el equipo de ayuda y asistencia para cancelar tu solicitud.","بنا به درخواست شما، حساب کاربریتان ظرف <time> آینده حذف خواهد شد. اگر نظرتان عوض شده است، برای لغو درخواست حذف، با «راهنمایی و پشتیبانی» تماس بگیرید.","Pyyntösi johdosta tilisi poistetaan <time> kuluttua. Jos olet muuttanut mieltäsi, ota meihin yhteyttä Ohjeen ja tuen kautta pyyntösi perumiseksi.","Suite à votre demande, votre compte sera supprimé dans <time>. Si vous avez changé d'avis, contactez notre assistance pour annuler votre demande de suppression.","Menanggapi permintaanmu, akun akan dihapus dalam <time>. Jika kamu berubah pikiran, hubungi Bantuan dan Dukungan untuk membatalkan permintaan penghapusan.","In seguito alla tua richiesta, l'account sarà eliminato tra <time>. Se vuoi annullare l'operazione, contatta l'assistenza.","お客様のご依頼により、このアカウントはあと<time>で削除されます。時間内に思いなおされた場合は、「ヘルプとサポート」より削除依頼キャンセルの旨をご連絡ください。","요청에 따라 <time> 후 계정이 삭제됩니다. 계정 삭제 요청을 취소하고 싶다면, 도움말 및 지원을 통해 삭제 요청을 취소해주세요.","Menurut permintaan, akaun anda akan dipadam dalam <time>. Jika anda mengubah fikiran, hubungi Bantuan dan Sokongan untuk membatalkan permintaan pemadaman anda.","Overeenkomstig je verzoek wordt je account verwijderd over <time>. Als je van gedachten bent veranderd, neem dan contact op met Hulp en ondersteuning om je verwijderingsverzoek te annuleren.","Siden du anmodet om det, vil kontoen din slettes om <time>. Hvis du har ombestemt deg, kan du ta kontakt med Hjelp og støtte for å kansellere anmodningen om sletting.","Atendendo ao seu pedido, sua conta será excluída em <time>. Caso tenha mudado de ideia, entre em contato com Ajuda e Suporte para cancelar a solicitação.","После запроса на удаление ваша учетная запись будет удалена через <time> Для отмены запроса на удаление обратитесь к разделу «Помощь и поддержка».","จากคำขอของท่าน บัญชีของท่านจะถูกลบภายใน <time> หากท่านเปลี่ยนใจ กรุณาติดต่อฝ่ายความช่วยเหลือและการสนับสนุนเพื่อยกเลิกคำขอลบบัญชี","Hesabın, isteğin üzerine <time> içinde silinecek. Fikrini değiştirdiysen Yardım ve Destek ile iletişime geçip silme isteğini iptal edebilirsin.","Theo yêu cầu của bạn, tài khoản của bạn sẽ bị xóa sau <time>. Nếu bạn đổi ý, hãy liên hệ bộ phận Trợ giúp và hỗ trợ để hủy yêu cầu xóa của bạn."
"TID_EVENT_ACHIEVEMENT_BOOSTER_XP_REWARD_CLAIMED","Event completed! You received <number>x <booster> and <xp> XP!","انتهى الحدث! حصلت على <number> من الـ<booster> <xp>ونقاط خبرة!","活动挑战已完成！您收到了x<number><booster>和<xp>经验值！","活動挑戰已完成！您收到了x<number><booster>和<xp>經驗值！","Ereignis abgeschlossen! Du hast <number>x <booster> und <xp> EP erhalten!","¡Evento completado! Has recibido <number>x <booster> y <xp> de XP.","رویداد تکمیل شد! <number> <booster> و <xp> دریافت کردید!","Tapahtuman saavutus suoritettu! Sait <number> x <booster> ja <xp> kokemuspistettä!","Évènement terminé ! Vous avez reçu <number>x<booster> et <xp> points d'EXP !","Acara selesai! Kamu mendapatkan <number>x <booster> dan <xp> XP!","Evento completato! Hai ricevuto <booster> (<number>) e <xp> XP!","イベントクリア！<booster><number>個と経験値<xp>を獲得しました！","이벤트 종료! <booster> <number>개와 <xp> XP를 획득했습니다!","Acara lengkap! Anda mendapat <number>x <booster> dan <xp> XP!","Evenement voltooid. Je ontvangt <number>x een <booster> en <xp> XP.","Hendelse fullført! Du fikk <number>x <booster> og <xp> XP!","Evento concluído! Você recebeu <number>x <booster> e <xp> de XP!","Событие завершено! <booster> (<number>) и опыт (<xp>) получены в награду!","อีเวนท์เสร็จสิ้นแล้ว! ท่านได้รับ <booster> x <number> และ <xp> XP!","Etkinlik tamamlandı! <number> <booster> ve <xp> TP kazandın!","Đã hoàn thành sự kiện! Bạn được nhận <number>x <booster> và <xp> Điểm Kinh nghiệm!"
"TID_NOT_ENOUGH_BOOSTERS","You don´t have enough of that Magic Item to do that.","ليس لديك ما يكفي من عنصر السحر هذا للقيام بذلك.","所需魔法物品数量不足，不能进行该操作。","所需魔法物品數量不足，無法進行此操作。","Du besitzt hierfür nicht genug Exemplare dieses magischen Gegenstandes.","No tienes suficientes objetos mágicos para hacer eso.","برای انجام آن کار به اندازه ‌کافی عتیقه جادویی ندارید.","Sinulla ei ole riittävästi tuota taikaesinettä tämän toiminnon suorittamiseksi.","Vous n'avez pas assez de copies de cet objet magique pour effectuer cette action.","Barang Sihirmu tidak cukup untuk melakukan hal itu.","Non puoi farlo perché non hai abbastanza artefatti.","必要な魔法アイテムが不足しています。","필요한 마법 아이템이 충분하지 않습니다.","Anda tidak mempunya item ajaib mencukupi untuk berbuat demikian.","Je hebt niet genoeg exemplaren van dit magische artefact om dit te kunnen doen.","Du har ikke nok av den magiske gjenstanden til å gjøre dette.","Você não tem o suficiente deste item mágico para realizar a ação.","Недостаточно этих волшебных предметов.","ท่านมีไอเทมเวทมนตร์ไม่พอจะทำเช่นนั้น","Bunu yapmak için gereken sayıda büyülü öğe yok.","Bạn không có đủ Vật phẩm Thần kỳ để làm điều đó."
"TID_SPECIAL_OFFER_EASTER_LIMITED_9999","Spring Special","مجموعة الربيع الخاصة","春季特惠","春季特惠","Frühlingsangebot","Lote especial","ویژه بهار","Kevättarjous","Offre du printemps","Spesial Musim Semi","Offerta di primavera","春の特別セール","봄맞이 특가","Istimewa Musim Bunga","Voorjaarsspecial","Vårspesial","Especial da Estação","Весенняя акция","พิเศษฤดูใบไม้ผลิ","Bahara Özel","Ưu đãi Mùa xuân Đặc biệt"
