"TID","EN","AR","CN","CNT","DE","ES","FA","FI","FR","ID","IT","JP","KR","MS","NL","NO","PT","RU","TH","TR","VI"
"string","string","string","string","string","string","string","string","string","string","string","string","string","string","string","string","string","string","string","string","string","string"
"TID_BUY_MISSING_RESOURCES_TEXT","Buy the missing <count> <resource>?","هل تريد شراء <count> <resource> المفقود؟","购买缺少的<count><resource>？","購買缺少的<count><resource>？","Fehlende(s) <count> <resource> kaufen?","Necesitas <count> de <resource>. ¿Quieres comprar?","مابقی <count> <resource> را خریداری می‌کنید؟","Ostetaanko puuttuvat resurssit: <count> <resource>?","Acheter les <count> <resource> nécessaires ?","Beli <count> <resource> yang kurang?","Vuoi acquistare le <count> unità di <resource> mancanti?","不足分の<count><resource>を買いますか？","부족한 <resource> <count>개를 구매할까요?","Beli <count> <resource> yang tiada?","Wil je de ontbrekende <count> eenheden <resource> kopen?","Kjøpe manglende <count> <resource>?","Comprar mais <count>x <resource>?","Купить недостающие ресурсы: <resource> (<count>)?","ซื้อ <count> <resource> ที่ขาดหายไปหรือไม่?","<count> <resource> eksik, satın alacak mısın?","Bạn muốn mua <count> <resource> còn thiếu không?"
"TID_BUY_MULTIPLE_MISSING_RESOURCES_TEXT_N2","Buy the missing <count1> <resource1> and <count2> <resource2>","شراء العناصر الناقصة: <count1> من <resource1> و<count2> من <resource2>","购买缺少的<count1><resource1>和<count2><resource2>？","購買缺少的<count1><resource1>和<count2><resource2>？","Möchtest du die folgenden fehlenden Ressourcen kaufen: <count1> <resource1> und <count2> <resource2>?","Necesitas <count1> de <resource1> y <count2> de <resource2>. ¿Quieres comprar?","مابقی <count1> <resource1> و <count2> <resource2> را می‌خرید؟","Ostetaanko puuttuvat resurssit: <count1> <resource1> ja <count2><resource2>?","Acheter les <count1> <resource1> et <count2> <resource2> qu'il vous manque.","Beli <count1> <resource1> dan <count2> <resource2> yang kurang?","Vuoi acquistare \q<resource1>\q (<count1> unità) e \q<resource2>\q (<count2> unità)?","不足分の<count1><resource1>と<count2> <resource2>を買いますか？","부족한 <resource1> <count1>개와 <resource2> <count2>개를 구매하시겠습니까?","Beli <count1> <resource1> dan <count2> <resource2> yang tiada","Wil je edelstenen gebruiken om de ontbrekende <count1> <resource1> en <count2> <resource2> te kopen?","Kjøp de nødvendige <count1> <resource1> og <count2> <resource2>","Comprar o que falta: <resource1> (<count1>) e <resource2> (<count2>)","Купить недостающие ресурсы: <resource1> (<count1>) и <resource2> (<count2>).","ซื้อ <count1> <resource1> และ <count2> <resource2> ที่ขาดหายไป","Eksik <count1> <resource1> ve <count2> <resource2> satın alınsın mı?","Mua <count1> <resource1> và <count2> <resource2> còn thiếu"
"TID_BUY_MULTIPLE_MISSING_RESOURCES_TEXT_N3","Buy the missing <count1> <resource1>, <count2> <resource2> and <count3> <resource3>?","أتريد شراء العناصر الناقصة: <count1> من <resource1> و<count2> من <resource2> و<count3> من <resource3>؟","购买缺少的<count1><resource1>、<count2><resource2>和<count3><resource3>？","購買缺少的<count1><resource1>、<count2><resource2>和<count3><resource3>？","Möchtest du die folgenden fehlenden Ressourcen kaufen: <count1> <resource1>, <count2> <resource2> und <count3> <resource3>?","Necesitas <count1> de <resource1>, <count2> de <resource2> y <count3> de <resource3>. ¿Quieres comprar?","مابقی <count1> <resource1>، <count2> <resource2> و <count3> <resource3> را خریداری می‌کنید؟","Ostetaanko puuttuvat resurssit: <count1> <resource1>, <count2> <resource2> ja <count3> <resource3>?","Acheter les ressources manquantes : <count1> <resource1>, <count2> <resource2> et <count3> <resource3> ?","Beli <count1> <resource1>, <count2> <resource2>, dan <count3> <resource3> yang diperlukan?","Vuoi acquistare le unità mancanti di \q<resource1>\q (<count1>), di \q<resource2>\q (<count2>) e di \q<resource3>\q (<count3>)?","不足分の<count1><resource1>、<count2><resource2>、<count3><resource3>を買いますか？","부족한 <resource1> <count1>개, <resource2> <count2>개, <resource3> <count3>개를 구매하시겠습니까?","Beli <count1> <resource1>, <count2> <resource2> dan <count3> <resource3> yang tiada?","Wil je de ontbrekende <count1> <resource1>, <count2> <resource2> en <count3> <resource3> kopen?","Vil du kjøpe de nødvendige <count1> <resource1>, <count2> <resource2> og <count3> <resource3>?","Comprar o que falta: <resource1> (<count1>), <resource2> (<count2>) e <resource3> (<count3>)?","Купить недостающие ресурсы: <resource1> (<count1>), <resource2> (<count2>) и <resource3> (<count3>)?","ซื้อ <resource1> <count1> หน่วย <resource2> <count2> หน่วย และ <resource3> <count3> หน่วยที่ขาดหายไปใช่หรือไม่?","Eksik <count1> <resource1>, <count2> <resource2> ve <count3> <resource3> satın alınsın mı?","Mua <count1> <resource1>, <count2> <resource2> và <count3> <resource3> còn thiếu?"
"TID_GEAR_ALREADY_EQUIPPED","Item is already equipped","العنصر مستخدم بالفعل","已装备该物品","已裝備該物品","Der Gegenstand wurde bereits ausgerüstet.","El objeto ya está equipado.","این مورد قبلاً تجهیز شده است","Varuste on jo käytössä.","Objet déjà équipé","Item sudah digunakan","L'equipaggiamento è già attivo.","アイテムをすでに装備しています","이미 장착한 아이템입니다","Item telah dilengkapi","Item is al toegepast.","Utstyret er allerede i bruk","Item já equipado","Уже используется","ติดตั้งไอเท็มแล้ว","Eşya zaten kuşanıldı.","Vật phẩm đã được trang bị rồi"
"TID_GEAR_INFO_ANGRY_TOME","Nearby friendly units do extra damage","تلحق الوحدات الودية القريبة ضررًا إضافيًا.","附近友军单位会造成额外伤害","附近友軍單位造成額外傷害","Verbündete Truppen in der Nähe verursachen mehr Schaden.","Las unidades aliadas cercanas infligen más daño.","واحدهای خودی مجاور آسیب بیشتری وارد می‌کنند","Lähistöllä olevat ystävälliset yksiköt tekevät lisätuhoa.","Les unités proches infligent des dégâts supplémentaires","Rekan Peleton terdekat akan memberikan kerusakan ekstra","Gli alleati vicini al gran sorvegliante causano danni extra.","近くの味方ユニットの与ダメージが上昇します","인근의 아군 유닛들이 추가 피해를 줍니다.","Unit sepasukan berdekatan melakukan kerosakan tambahan","Nabije vriendschappelijke eenheden richten extra schade aan.","Allierte enheter i nærheten gjør ekstra skade","Unidades aliadas próximas causam dano extra","Ближайшие воины наносят дополнительный урон.","หน่วยพันธมิตรใกล้ๆ สร้างความเสียหายเพิ่มเติม","Yakınlardaki dost birlikler ekstra hasar verir.","Các đơn vị đồng minh ở gần gây ra thêm sát thương"
"TID_GEAR_INFO_ARCHER_CROWN","Summons a gang of Archers","لاستدعاء عصابة راميات سهام.","召唤一群弓箭手","召喚一群弓箭手","Beschwört eine Gruppe Bogenschützinnen.","Invoca un grupo de arqueras.","گروهی از کماندارها را احضار می‌کند","Kutsuu joukon jousiampujia.","Invoque un groupe d'archères","Mengerahkan kawanan Pemanah","Evoca una serie di arcieri.","アーチャーの集団を召喚します","아처 부대를 소환합니다.","Menyeru sekumpulan Pemanah.","Roept een bende boogschutters op.","Påkaller en gjeng bueskyttere","Conjura uma leva de Arqueiras","Призывает группу лучниц.","อัญเชิญแก๊งพลธนูออกมา","Bir grup Okçu çağırır.","Triệu hồi một nhóm Cung thủ"
"TID_GEAR_INFO_BARBARIAN_CROWN","Summons a pack of raged Barbarians","لاستدعاء مجموعة من البرابرة الغاضبين","召唤一群狂暴野蛮人","召喚一群狂暴野蠻人","Beschwört eine Horde wütender Barbaren.","Invoca una manada de bárbaros enfurecidos.","گروهی از بربرهای عصبانی را احضار می‌کند","Kutsuu joukon raivokkaita barbaareja.","Invoque un groupe de barbares enragés","Mengerahkan kawanan Orang Barbar Marah","Evoca una sfilza di barbari furiosi.","レイジバーバリアンの集団を召喚します","분노한 바바리안 무리를 소환합니다.","Menyeru sekumpulan Orang Gasar Berang.","Roept een horde woedende barbaren op.","Påkaller en flokk sinte barbarer","Conjura uma leva de Bárbaros Furiosos","Призывает группу разъяренных варваров.","อัญเชิญกองกำลังคนเถื่อนคลุ้มคลั่งออกมา","Bir grup öfkeli Barbar çağırır.","Triệu hồi một nhóm Man di Cuồng nộ"
"TID_GEAR_INFO_EARTHQUAKE_BOOTS","Causes a powerful earthquake which destroys walls and damages buildings","تسبب زلزالاً قويًا يدمر الجدران ويلحق الضرر بالمباني.","引发强烈地震，摧毁城墙并对建筑造成伤害","引發強烈地震，摧毀城牆並對建築物造成傷害","Beschwört ein mächtiges Erdbeben, das Mauern zerstört und Schaden an Gebäuden verursacht.","Provoca un fuerte terremoto que destruye muros y daña las estructuras.","باعث ایجاد زلزله‌ای قوی می‌شود که دیوارها را تخریب می‌کند و به ساختمان‌ها آسیب می‌رساند","Aiheuttaa voimakkaan maanjäristyksen, joka tuhoaa muureja ja vahingoittaa rakennuksia.","Provoque un puissant séisme qui détruit les remparts et endommage les bâtiments","Menimbulkan gempa bumi dahsyat yang akan menghancurkan tembok dan memberikan kerusakan pada bangunan","Permettono al re barbaro di scatenare un potente terremoto in grado di distruggere le mura e di danneggiare gli edifici.","強力な地震を引き起こして壁を破壊し、建物にダメージを与えます","장벽을 부수고 건물에 피해를 주는 강력한 지진을 일으킵니다.","Menyebabkan gempa bumi kuat yang memusnahkan benteng dan merosakkan bangunan.","Veroorzaakt een krachtige aardbeving die muren vernietigt en gebouwen beschadigt.","Lager et voldsomt jordskjelv som ødelegger murer og skader bygninger","Causa um terremoto poderoso que destrói muros e causa dano a construções","Вызывает мощное землетрясение, которое разрушает стены и наносит урон зданиям.","สร้างแผ่นดินไหวทรงพลังที่ทำลายกำแพงและสร้างความเสียหายต่อสิ่งก่อสร้าง","Duvarları yıkan ve binalara hasar veren güçlü bir deprem başlatır.","Gây ra một trận động đất dữ dội, phá hủy tường thành và gây tổn hại lên các công trình"
"TID_GEAR_INFO_ETERNAL_TOME","Grand Warden and all nearby friendly units become immune to damage","يصبح الآمر الكبير وكل الوحدات الصديقة القريبة محصنين ضد الضرر.","大守护者和附近所有友军单位免疫伤害","大守護者和附近所有友軍單位免疫傷害","Der Große Wächter und alle verbündeten Truppen in der Nähe werden immun gegen Schaden.","El gran centinela y todas las unidades aliadas cercanas se vuelven inmunes al daño.","نگهبان بزرگ و همه واحدهای خودی مجاور در مقابل آسیب ایمن می‌شوند","Suursuojelija ja kaikki lähistöllä olevat ystävälliset joukot muuttuvat immuuneiksi tuholle.","Rend le Grand gardien et toutes les troupes alliées proches insensibles aux dégâts","Wali Besar dan seluruh rekan Peleton di dekatnya menjadi kebal terhadap kerusakan","Rende il gran sorvegliante e gli alleati nelle sue vicinanze immuni a qualsiasi danno.","グランドウォーデン自身と近くの味方ユニットに対するダメージを無効にします","그랜드 워든과 인근의 아군 유닛들이 무적 상태가 됩니다.","Warden Besar dan semua unit sepasukan berdekatan menjadi imun terhadap kerosakan.","De nobele wachter en alle nabije vriendschappelijke eenheden worden immuun voor schade.","Storvokteren og alle allierte enheter i nærheten blir immune mot skade","O Grande Guardião e todas as unidades aliadas próximas ficam imunes a dano","Хранитель и ближайшие воины становятся неуязвимыми.","ผู้คุมยิ่งใหญ่และหน่วยพันธมิตรใกล้ๆ ทั้งหมดต้านทานต่อความเสียหาย","Büyük Koruyucu ve yakınlarındaki dost birlikler hasar almaz.","Đại Quản giáo và các đơn vị đồng minh ở gần sẽ không chịu sát thương"
"TID_GEAR_INFO_FROZEN_ARROW","Icy arrows slow down the targets they hit","تعمل السهام الجليدية على إبطاء الأهداف التي تصيبها.","冰封箭矢会减缓被命中目标的速度","冰封箭矢會減緩被命中目標的速度","Frostpfeile verlangsamen getroffene Ziele.","Las flechas heladas ralentizan a los objetivos a los que golpean.","تیرهای یخی اهداف مورد اصابتشان را کُند می‌کنند","Jäiset nuolet hidastavat kohteita, joihin ne osuvat.","Les flèches glacées ralentissent les ennemis touchés","Panah Es akan melambatkan gerakan target yang terkena","Scaglia frecce in grado di rallentare i bersagli colpiti.","氷の矢を撃ち出して、命中した目標をスローダウンさせます","명중 시 적을 느리게 만듭니다.","Anak panah berais memperlahankan sasaran yang mengenainya.","IJzige pijlen vertragen de doelwitten die ze raken.","Isete piler sinker målene de treffer","Flechas congelantes desaceleram os alvos quando os atingem","Ледяные стрелы замедляют пораженную цель.","ลูกธนูแช่แข็งทำให้เป้าหมายที่ถูกยิงโดนเคลื่อนที่ได้ช้าลง","Buzlu oklar isabet ettikleri hedefleri yavaşlatır.","Mũi tên băng giá khiến các mục tiêu bị bắn trúng hoạt động chậm lại"
"TID_GEAR_INFO_HEALER_JAR","Summons a flock of Healers","لاستدعاء مجموعة من المعالجات.","召唤一群天使","召喚一群天使","Beschwört eine Gruppe Heiler.","Invoca un grupo de curanderas.","دسته‌ای از شفادهنده‌ها را احضار می‌کند","Kutsuu joukon parantajia.","Invoque un groupe de guérisseuses","Mengerahkan kawanan Penyembuh","Evoca un gruppo di guaritori.","ヒーラーの集団を召喚します","치유사 부대를 소환합니다.","Menyeru sekumpulan Penyembuh.","Roept een groep helers op.","Påkaller en flokk helbredere","Conjura uma leva de Curadoras","Призывает группу целительниц.","อัญเชิญกลุ่มผู้เยียวยาออกมา","Bir grup Şifacı çağırır.","Triệu hồi một nhóm Thầy thuốc"
"TID_GEAR_INFO_HEALING_TOME","Heals the Grand Warden and all nearby friendly units","لشفاء الآمر الكبير وجميع الوحدات الصديقة القريبة.","治疗大守护者和所有附近友军单位","治療大守護者和附近所有的友軍單位","Heilt den Großen Wächter und alle verbündeten Truppen in der Nähe.","Cura al gran centinela y a todas las unidades aliadas cercanas.","نگهبان بزرگ و همه واحدهای خودی مجاور را شفا می‌دهد","Parantaa suursuojelijaa ja kaikkia lähistöllä olevia ystävällisiä joukkoja.","Soigne le Grand gardien et toutes les troupes alliées proches","Menyembuhkan Wali Besar dan seluruh rekan Peleton di sekitar","Ripristina parte della salute del gran sorvegliante e degli alleati nelle sue vicinanze.","グランドウォーデン自身と近くの味方ユニットを回復します","그랜드 워든과 인근의 아군 유닛들을 회복합니다.","Menyembuhkan Warden Besar dan semua unit sepasukan berdekatan.","Geneest de nobele wachter en alle nabije vriendschappelijke eenheden.","Helbreder storvokteren og alle allierte enheter i nærheten","O Grande Guardião e todas as unidades aliadas próximas são curados","Исцеляет хранителя и всех ближайших воинов.","เยียวยาผู้คุมยิ่งใหญ่และหน่วยพันธมิตรใกล้ๆ ทั้งหมด","Büyük Koruyucuyu ve yakınlardaki tüm dost birlikleri iyileştirir.","Hồi máu cho Đại Quản giáo và các đơn vị đồng minh ở gần"
"TID_GEAR_INFO_IRON_FIST","Casts Rage on the Barbarian King","لإلقاء تعويذة الغضب على الملك البربري.","使野蛮人之王获得狂暴效果","使野蠻人之王獲得狂暴效果","Verleiht dem Barbarenkönig einen Wutzauber.","Aplica la furia en el rey bárbaro.","روی شاه بربرها طلسم خشم می‌اندازد","Saa barbaarikuninkaan raivon valtaan.","Lance un sort de rage sur le Roi des barbares","Memberikan efek Amarah pada Raja Barbar","Rende il re barbaro particolarmente furioso.","バーバリアンキングにレイジを付与します","바바리안 킹에게 분노 마법을 적용합니다.","Menyihir kemarahan pada Raja Orang Gasar.","Maakt de barbarenkoning woedend.","Tryller raseri på barbarkongen","Deixa o Rei Bárbaro furioso","Применяет заклинание ярости к королю варваров.","ร่ายอาคมคลุ้มคลั่งให้ราชันคนเถื่อน","Barbar Kral'a öfke büyüsü yapar.","Niệm thần chú Cuồng nộ lên Man di Vương"
"TID_GEAR_INFO_LIFE_GEM","Nearby friendly units gain extra hitpoints","تحصل الوحدات الصديقة القريبة على نقاط إصابة إضافية.","附近友军单位获得额外生命值","附近友軍單位獲得額外生命值","Verbündete Truppen in der Nähe erhalten zusätzliche Trefferpunkte.","Las unidades aliadas cercanas obtienen más puntos de vida.","واحدهای خودی مجاور تحمل ضربه بیشتری کسب می‌کنند","Lähistöllä olevat ystävälliset joukot saavat lisää elämäpisteitä.","Les troupes alliées proches reçoivent des PV supplémentaires","Rekan Peleton terdekat akan mendapat Nyawa ekstra","Aumenta i punti ferita degli alleati vicini all'eroe.","近くの味方ユニットのヒットポイントが上昇します","인근의 아군 유닛들이 추가 HP를 획득합니다.","Unit sepasukan berdekatan mendapat nilai nyawa tambahan.","Nabije vriendschappelijke eenheden krijgen extra levenspunten.","Allierte enheter i nærheten får ekstra treffpoeng","Unidades aliadas próximas ganham pontos de vida extras","Здоровье ближайших воинов увеличивается.","หน่วยพันธมิตรใกล้ๆ ได้รับพลังชีวิตเพิ่มเติม","Yakınlardaki dost birlikler ekstra can kazanır.","Các đơn vị đồng minh ở gần sẽ nhận thêm máu"
"TID_GEAR_INFO_ROYAL_CLOAK","Turns the Queen invisible and gives her stronger attacks","لجعل الملكة تختفي ومنحها هجمات أقوى.","使弓箭女皇隐身并强化其攻击","使弓箭女皇隱形並強化其攻擊","Macht die Königin unsichtbar und verstärkt ihre Attacken.","Hace a la reina invisible y fortalece sus ataques.","ملکه را نامرئی می‌کند و حملات او را قوی‌تر می‌کند","Muuttaa jousikuningattaren näkymättömäksi ja tehostaa hänen hyökkäyksiään.","Rend la Reine invisible et plus puissante","Mengubah Ratu menjadi tak terlihat dan memberinya serangan yang lebih kuat","Rende la regina invisibile e i suoi attacchi ancora più potenti.","クイーンを透明化して攻撃を強化します","퀸을 투명화하고 공격력을 강화합니다.","Membuat Permaisuri halimunan dan memperkuat serangannya.","Maakt de koningin onzichtbaar en geeft haar sterkere aanvallen.","Gjør dronningen usynlig og gir henne sterkere angrep","Deixa a Rainha Arqueira invisível e seus ataques mais fortes","Делает королеву невидимой и усиливает ее атаку.","เปลี่ยนราชินีให้ล่องหนและทำให้เธอแข็งแกร่งขึ้น","Kraliçe'yi görünmez yapar ve saldırılarını güçlendirir.","Nữ hoàng sẽ tàng hình và có lực tấn công mạnh hơn"
"TID_GEAR_INFO_VAMPSTACHE","Every time the Barbarian King attacks, he heals himself","في كل مرة يهاجم فيها الملك البربري، يعالج نفسه.","野蛮人之王每次攻击都会治疗自身","野蠻人之王每次攻擊都會治療自己","Der Barbarenkönig heilt sich mit jedem Angriff.","Cada vez que el rey bárbaro ataca, se cura.","شاه بربرها هر بار که حمله می‌کند، خودش را شفا می‌دهد","Barbaarikuningas parantaa itseään jokaisen hyökkäyksen myötä.","Le Roi des barbares récupère des PV à chaque fois qu'il attaque","Tiap kali Raja Barbar menyerang, dia akan memulihkan diri sendiri","Il re barbaro ripristina parte della sua salute con ogni attacco che sferra.","バーバリアンキングが攻撃するたびに自身を回復します","바바리안 킹이 공격할 때마다 체력을 회복합니다.","Setiap kali Raja Orang Gasar menyerang, dia menyembuhkan dirinya.","Elke keer dat de barbarenkoning aanvalt, herstelt hij zichzelf.","Hver gang barbarkongen angriper, helbreder han seg selv","Toda vez que ataca, o Rei Bárbaro também se cura","Король варваров исцеляет себя с каждой атакой.","ทุกครั้งที่ราชันคนเถื่อนโจมตี เขาจะเยียวยาตัวเองไปด้วย","Barbar Kral her saldırdığında kendini iyileştirir.","Man di Vương tự hồi máu sau mỗi lần ra đòn tấn công"
"TID_GEAR_POPUP_DRAG_INFO","Drag icons to assign Equipment to Heroes","اسحب الأيقونات لتعيين المعدات للأبطال.","拖动图标为英雄配置装备","拖動圖示為英雄穿戴裝備","Ziehe Ausrüstung auf Helden, um sie ihnen zuzuweisen.","Arrastra iconos para asignar equipo a los héroes.","برای تخصیص تجهیزات به قهرمانان، نمادها را بکشید","Raahaa ikoneita valitaksesi varusteet sankareillesi.","Faites glisser pour en équiper les héros","Geser ikon untuk menggunakan Peralatan Pahlawan","Per attivare un equipaggiamento, trascina la sua icona sull'eroe.","アイコンをドラッグするとヒーローに装備できます","아이콘을 드래그해 장비를 영웅에게 장착하세요.","Seret ikon untuk mmberi pelengkapan kepada wira","Sleep de pictogrammen om uitrustingen aan helden te geven.","Dra ikoner for å utruste helter med utstyr","Arraste os ícones para equipar os heróis","Перетяните иконку, чтобы снарядить героя","ลากไอคอนเพื่อเลือกอุปกรณ์ให้กับผู้กล้า","Kahramanları ekipmanla kuşatmak için simgeleri sürükle.","Nhấn kéo biểu tượng để giao Trang bị cho Tướng"
"TID_GEAR_RARITY_EPIC","Epic","ممتاز","史诗","史詩","Episch","Épico","حماسی","Eeppinen","Épique","Epik","Epico","スーパーレア","초희귀","Epik","Episch","Episk","Épico","Эпическое","อีปิค","Destansı","Quý hiếm"
"TID_GEAR_RESOURCE_COMMON","Shiny Ore","معدن خام لامع","闪亮矿石","閃光礦石","Glanzerz","Minerales brillantes","سنگ معدن براق","Kimallemalmia","Minerai brillant","Mineral Berkilau","Minerali lucenti","ブルー鉱石","빛나는 광석","Bijih Berkilau","Glanzend erts","Blank malm","Minério azul","Блестящая руда","แร่วิบวับ","Parlak Cevher","Quặng sáng bóng"
